classmark,title,date_from,date_to,summary,medical_terms
MS-TS-AR-00040-00137,Medical,0500-01-01,1899-12-31,"Opening page of the ninth discourse of the first part of Al-Majūsī, Kāmil al-Ṣināʿa, including the title and the beginning of chapter 1 on internal diseases (ed. Būlāq 1877, I: 319-320). The title and author’s name are copied on f. 1v in alternating black and red ink. F. 1r contains a note, in a different hand from the main text (and in a less bookish style), noting that the muḥtasib of the city should ask the doctor about the number, the form and the place of the bones in the human body.","['body', 'bone', 'disease', 'doctor', 'hand', 'human', 'red']"
MS-TS-AR-00040-00140,Medical; magical,0500-01-01,1899-12-31,Instructions for preparing amulets that will benefit those who have problems urinating and for a successful childbirth. Drawings of stars at the bottom of the fragment.,"['bottom', 'childbirth', 'preparing', 'star', 'urinating']"
MS-TS-AR-00040-00145,Medical,0500-01-01,1899-12-31,"Passage from ʿAlī ibn ʿĪsā, Taḏkirat al-kaḥḥālīn (‘Memorandum for opticians’), second discourse, end of chapter 64 and beginning of chapter 65 (ed. Hyderabad 1964, pp. 240-242), on the different diagnostics of ulcers and wounds to the cornea.","['cornea', 'diagnostics', 'optician', 'ulcer', 'wound']"
MS-TS-AR-00040-00146,Medical,0500-01-01,1899-12-31,"From the introduction to Avicenna, Al-qanūn fī l-ṭibb (‘Canon of medicine’), discussing the nature and object of study of medicine (ed. Būlāq 1871, I:4).",['medicine']
MS-TS-AR-00040-00147,Medical,0500-01-01,1899-12-31,"From a work on materia medica, focussing on the use of vegetable simples and their qualities.","['medica', 'vegetable']"
MS-TS-AR-00040-00148,Medical,0500-01-01,1899-12-31,"Collection of passages from various unidentified texts dealing with medicine and in particular with the generation of heath in the body (f. 1r), symptoms of crises, fevers and rigors (ff. 1r-v), and heaviness in the head (f. 2v).","['body', 'fever', 'head', 'heath', 'heaviness', 'medicine', 'rigor']"
MS-TS-AR-00040-00149,Medical; magical,0500-01-01,1899-12-31,"Fragment from a booklet concerned with the cure of pains and swellings, by means of magical and medical intervention. The fragment contains both magical formulae and a list of simples to be used for curing the conditions referred to. Simples mentioned include saffron, costus, and camphor.","['camphor', 'condition', 'cure', 'curing', 'magical', 'medical', 'pain', 'saffron', 'swelling']"
MS-TS-AR-00040-00150,Medical,0500-01-01,1899-12-31,"From an Arabic medical book dealing with the four humours, describing the different kinds of phlegm, of blood, and bile. Galen is mentioned on verso in relation to the balancing of humours in the body.","['balancing', 'bile', 'blood', 'body', 'galen', 'humour', 'medical', 'phlegm']"
MS-TS-AR-00040-00152,Medical,0500-01-01,1899-12-31,"From a book on materia medica, mentioning the following simples: violet, jasmine, marjoram and rose, all useful to treat headache and health conditions. Instructions for preparing confections from quince and walnuts.","['condition', 'headache', 'health', 'jasmine', 'marjoram', 'medica', 'preparing', 'quince', 'rose', 'treat', 'violet', 'walnut']"
MS-TS-AR-00040-00155,Medical,0500-01-01,1899-12-31,"Bifolium from a medical book focussing on the harmonisation of the elements in the body. The treatise appears to be divided into sections called risāla - the mutilated beginning of one risāla is partly visible on f. 2r. Mention is made of Al-Rāzī who recommended a remedy for bloody diarrhoea made up of apple, vinegar, plantago seed and aged cheese.","['apple', 'bloody', 'body', 'cheese', 'diarrhoea', 'medical', 'mutilated', 'plantago', 'remedy', 'vinegar']"
MS-TS-AR-00040-00157,Medical,0500-01-01,1899-12-31,"Page from a book on materia medica, mostly focussing on simples that are useful for headaches and problems with the brain: fennel, gentian, alarm, honey, resin, musk, amber, nard, castor and saffron.","['amber', 'brain', 'castor', 'fennel', 'headache', 'honey', 'medica', 'musk', 'nard', 'resin', 'saffron']"
MS-TS-AR-00040-00159,Medical,0500-01-01,1899-12-31,"Three recipes for treating toothache, using local applications and rinsing. Mention is made of the beneficial effects of reading the Qur’ān.","['toothache', 'treating']"
MS-TS-AR-00040-00160,Medical,0500-01-01,1899-12-31,"Leaf from a medical work dealing with children’s health, in particular with the curing of umbilical hernia causing crying. Simples prescribed include dried rose, mastic, ceruse, honey, natron, and borax.","['borax', 'causing', 'ceruse', 'child', 'curing', 'health', 'hernia', 'honey', 'mastic', 'medical', 'natron', 'prescribed', 'rose', 'umbilical']"
MS-TS-AR-00040-00162,Medical,0500-01-01,1899-12-31,"Bifolium from a medical work giving treatments for various ailments: convulsions, tetany, fevers and colics. Simples prescribed for such purposes are styrax balsam, wax, oil of lily, linseed oil, castor oil, almond oil, mint, rue, borax and colocynth.","['ailment', 'almond', 'balsam', 'borax', 'castor', 'colic', 'colocynth', 'convulsion', 'fever', 'lily', 'linseed', 'medical', 'mint', 'oil', 'prescribed', 'tetany', 'treatment', 'wax']"
MS-TS-AR-00040-00165,Medical; astrology,0500-01-01,1899-12-31,Medico-astrological text dealing with astrological prognostication for the day of birth of an infant and possible illnesses caused by the unfavourable alignments of stars.,"['astrological', 'birth', 'caused', 'illness', 'infant', 'medico-astrological', 'star']"
MS-TS-AR-00040-00168,Medical,0500-01-01,1899-12-31,"From Avicenna, Al-qanūn fī l-ṭibb (‘Canon of medicine’), the introductory discussion on medicine (ed. Būlāq 1871, I:4).",['medicine']
MS-TS-AR-00040-00171,Medical,0500-01-01,1899-12-31,"Part of a medical work, including the beginning of chapter 15 (f. 1r) concerning swelling of the breast due to inflammation, its symptoms, causes and and treatments for it. Three different preparations are described: a mixture of bread and powder of celery; a mixture of Armenian bole, coriander and oil of rose; a mixture of egg white, sesame oil and bean flour.","['bean', 'bread', 'breast', 'cause', 'celery', 'coriander', 'egg', 'flour', 'inflammation', 'medical', 'oil', 'powder', 'preparation', 'rose', 'sesame', 'swelling', 'treatment']"
MS-TS-AR-00040-00172,Medical,0500-01-01,1899-12-31,"Passage from ʿAlī ibn ʿĪsā, Taḏkirat al-kaḥḥālīn (‘Memorandum for opticians’), first discourse, chapters 13-14 and 17-18, dealing with arachnoid, watery humour, conjunctivae and the muscles of the eye (ed. Hyderabad 1964, pp. 25-26, 30-31).","['conjunctiva', 'eye', 'humour', 'muscle', 'optician', 'watery']"
MS-TS-AR-00040-00174,Medical,0500-01-01,1899-12-31,"Arabic translation of an unidentified work by Galen - it mentions Galen’s commentary on Hippocrates and deals with attractive and repulsive faculties of the body, food and taste.","['body', 'food', 'galen', 'hippocrates']"
MS-TS-AR-00040-00175,Medical,0500-01-01,1899-12-31,"Part of a medical work focussing on the management of patients at difficult times of disease and crisis, with descriptions of signs of recovery.","['disease', 'medical', 'patient']"
MS-TS-AR-00040-00179,Medical; literature,0500-01-01,1899-12-31,"Recto: theoretical assessment of the causes of diarrhoea (the disintegration of stool in intestines) and a cure for it; preparation of a powder with a mixture of rose seeds, sandalwood, coriander, purslane, chalk, oak, chestnut and mastic. Mention of Avicenna, Al-qanūn fī l-ṭibb (‘Canon of medicine’). Verso: literary passage in Arabic, followed by poetic verses.","['assessment', 'cause', 'chalk', 'coriander', 'cure', 'diarrhoea', 'disintegration', 'intestine', 'mastic', 'medicine', 'oak', 'powder', 'preparation', 'purslane', 'rose', 'sandalwood', 'stool']"
MS-TS-AR-00040-00180,Medical,0500-01-01,1899-12-31,"Leaf from a book on pharmacopoeia describing different kinds of powder: one for diarrhoea and for strengthening the stomach uses seeds of garden cress, cumin soaked in wine vinegar, leek, myrobalan and blue bdellium; another powder, composed of crushed pearls, is recommended for depression, palpitation, strengthening the stomach and liver and rebalancing a hot temperament.","['bdellium', 'cress', 'crushed', 'cumin', 'depression', 'diarrhoea', 'hot', 'leek', 'liver', 'myrobalan', 'palpitation', 'pearl', 'pharmacopoeia', 'powder', 'soaked', 'stomach', 'strengthening', 'vinegar', 'wine']"
MS-TS-AR-00040-00181,Medical,0500-01-01,1899-12-31,"Leaf from a medical work dealing with different kinds of fevers: ephemeral, hectic phthisic fevers as well as those derived from putrefaction. The title page of the section, recto, is rubricated.","['fever', 'medical', 'phthisic', 'putrefaction']"
MS-TS-AR-00040-00193,Medical,0500-01-01,1899-12-31,"From ʿAlī ibn ʿĪsā, Taḏkirat al-kaḥḥālīn (‘Memorandum for opticians’), first discourse, chapters 13-16, dealing with the anatomy of the layers of the eye, parallel to ed. Hyderabad 1963, pp. 25-29.","['anatomy', 'eye', 'optician']"
MS-TS-AR-00040-00194,Medical,0500-01-01,1899-12-31,"Description of a regimen for increasing weight over a span of 40 days. It recommends eating almonds, pistachios, hazelnuts, chickpeas, fava beans, rice, autumn crocus and mastic. All these ingredients should be prepared with milk and sugar.","['almond', 'bean', 'chickpea', 'crocus', 'hazelnut', 'mastic', 'milk', 'pistachio', 'prepared', 'regimen', 'rice', 'sugar', 'weight']"
MS-TS-AR-00040-00198,Medical,0500-01-01,1899-12-31,"Leaf from a medical work in the form of questions and answers, probably for educational purposes. Answers given deal with the muscles of the eyes, their ailments and treatment.","['ailment', 'eye', 'medical', 'muscle', 'treatment']"
MS-TS-AR-00040-00205,Medical,0500-01-01,1899-12-31,"Translation of Hippocrates, Coan Prognosis no.156 (Loeb library, Hippocrates, vol. X).","['coan', 'hippocrates', 'loeb', 'prognosis']"
MS-TS-AR-00041-00003,Medical,0500-01-01,1899-12-31,"Arabic translation of Hippocrates, Aphorisms I: 25-II: 2; II: 12-15.","['aphorism', 'hippocrates']"
MS-TS-AR-00041-00004,Medical; jottings,0500-01-01,1899-12-31,"Conclusion of the tenth discourse of the fourth part of al-Ṭabarī, Firdaws al-Ḥikma, where the case of a dying person is described. The fragment contains a description of a cure for flatulence and prescribes castor oil as a purgative and sagapenum for vomiting. Both versos contain jottings.","['castor', 'cure', 'dying', 'flatulence', 'oil', 'prescribes', 'purgative', 'sagapenum', 'vomiting']"
MS-TS-AR-00041-00007,Medical,0500-01-01,1899-12-31,"From an Arabic translation of Galen, De alimentorum facultatibus (Kitāb quwā al-aḡḏiyah; ‘On the faculties of foods’). Verso includes the colophon of the book, without indication of date or ownership.","['colophon', 'food', 'galen']"
MS-TS-AR-00041-00012,Medical,0500-01-01,1899-12-31,"From a medical book of mixed content: medical theory regarding the faculties of the body and how they are affected by fevers; various medical recipes, some of which are copied under the authority of Abū ʿAbdallāh ibn al-Maʿrūf.","['body', 'fever', 'medical']"
MS-TS-AR-00041-00013,Medical,0500-01-01,1899-12-31,"Leaf from a work on materia medica, It mentions Galen and deals with the following simples: psyllium, althea, honey, wormwood, agaric, myrobalan, and anchusa.","['anchusa', 'galen', 'honey', 'medica', 'myrobalan', 'psyllium', 'wormwood']"
MS-TS-AR-00041-00021,Medical,0500-01-01,1899-12-31,"Leaf from a work on ophthalmology, focussing on swellings and atrophy of the eye, possibly caused by errors of the oculist. Eye drops and powders are recommended as possible treatments, together with cautery. Mention is made of Andarani salt, crocus, anemone extracts and kohl of antimony as useful simples.","['antimony', 'atrophy', 'caused', 'cautery', 'crocus', 'eye', 'oculist', 'ophthalmology', 'powder', 'salt', 'swelling', 'treatment']"
MS-TS-AR-00041-00025,Medical,0500-01-01,1899-12-31,"From a medical work dealing with fevers, particularly with quartan and tertian fevers, their symptoms, progress and possible damages to spleen and stomach.","['fever', 'medical', 'spleen', 'stomach', 'tertian']"
MS-TS-AR-00041-00029,Medical; perfumery,0500-01-01,1899-12-31,"Leaves from a booklet (possibly for personal use) with extracts of recipes from Al-Kindī, Kitāb kīmīyā’ al-ʿiṭr (‘The chemistry of perfume’), including preparations with cinnamon, cardamom, lichen, nard, tailed pepper, cinnamon, camphor, saffron, musk and rose-water.","['camphor', 'cardamom', 'cinnamon', 'lichen', 'musk', 'nard', 'pepper', 'perfume', 'preparation', 'rose-water', 'saffron']"
MS-TS-AR-00041-00030,Medical,0500-01-01,1899-12-31,"Leaf from a work on dentistry, with a discussion of the danger of suffocation caused by a swollen tongue; prescription of opium or infusion of colocynth root in vinegar for numbing the gums before extraction of teeth. Mention of Galen.","['caused', 'colocynth', 'dentistry', 'galen', 'gum', 'infusion', 'numbing', 'prescription', 'root', 'suffocation', 'swollen', 'teeth', 'tongue', 'vinegar']"
MS-TS-AR-00041-00032,Medical,0500-01-01,1899-12-31,"Bifolium from a medical work dealing with diabetes, and the unquenched thirst and hunger of those who suffer from it. The fragment advices the doctor to bear in mind that these symptoms could be taken as sign of bulimia.","['bear', 'bulimia', 'diabetes', 'doctor', 'hunger', 'medical', 'mind', 'suffer', 'thirst', 'unquenched']"
MS-TS-AR-00041-00037,Medical,0500-01-01,1899-12-31,"Pages from a work on materia medica with simples arranged alphabetically, here preserving the heading of chapter 6, dealing with the letter ḥāʾ: asafoetida, nutmeg, mehleb, chalk, carraway seeds and water, turpeth, honey, gum Arabic, saffron, iron, sumac juice, tamarind, and sugar.","['asafoetida', 'carraway', 'chalk', 'gum', 'honey', 'iron', 'juice', 'medica', 'mehleb', 'nutmeg', 'saffron', 'sugar', 'sumac', 'tamarind', 'turpeth', 'water']"
MS-TS-AR-00041-00038,Medical,0500-01-01,1899-12-31,Bifolium from a medical work dealing with the different parts of the body and the illnesses that may affect them.,"['body', 'illness', 'medical']"
MS-TS-AR-00041-00040,Medical,0500-01-01,1899-12-31,"Leaf from a work on ophthalmology, listing a variety of ailments of the eye, including dimness of vision and lowering of the eyelids, and prescribing marcasite, copper, lead, lycium, cadmia, borax, aloe, saffron, mustard and black pepper as useful simples.","['ailment', 'aloe', 'borax', 'cadmia', 'dimness', 'eye', 'eyelid', 'lead', 'lycium', 'marcasite', 'mustard', 'ophthalmology', 'pepper', 'prescribing', 'saffron', 'vision']"
MS-TS-AR-00041-00041,Medical; autograph,0500-01-01,1899-12-31,"Recto: beginning of an Arabic translation of Nicolaus Damascenus’ synopsis of Pseudo-Aristotle (probably Nicolaus himself), De Plantis. Verso: autograph signature of Moses Maimonides who once owned the book.",['plantis']
MS-TS-AR-00041-00044,Medical,0500-01-01,1899-12-31,"Leaf from a work on materia medica, mentioning Dioscorides, Galen and Ibn Māsawayh as authorities. Simples described include different kinds of hyssop.","['galen', 'hyssop', 'medica']"
MS-TS-AR-00041-00045,Medical,0500-01-01,1899-12-31,"Leaf from a work on material medica, listing the following simples: lycium, salt, olive oil, barley-water and tutty, which are pronounced useful for treating various diseases: swelling of the eyelids, pustules on the tongue, protuberance of the eyes, sciatica, toothache and stomach ache, pains in the spleen and bladder.","['ache', 'barley-water', 'bladder', 'disease', 'eye', 'eyelid', 'lycium', 'medica', 'oil', 'olive', 'pain', 'protuberance', 'pustule', 'salt', 'sciatica', 'spleen', 'stomach', 'swelling', 'tongue', 'toothache', 'treating']"
MS-TS-AR-00041-00046,Medical,0500-01-01,1899-12-31,"Leaf from a medical work dealing with organs of the chest and abdomen, arteries and veins. Belongs with T-S Ar.41.47.","['abdomen', 'chest', 'medical', 'organ', 'vein']"
MS-TS-AR-00041-00047,Medical,0500-01-01,1899-12-31,"Leaves from a medical work dealing with palpitations, asthma and crises and how to treat them with potions.","['asthma', 'medical', 'palpitation', 'potion', 'treat']"
MS-TS-AR-00041-00051,Medical,0500-01-01,1899-12-31,"Bifolium from Al-Majūsī, Kāmil al-ṣināʿa, third discourse of the first part, chapters 34-36, dealing with the foetus in the womb, the anatomy of the breast, testes and seminal vessels (ed. Būlāq 1877, I: 120-122).","['anatomy', 'breast', 'foetus', 'testis', 'vessel', 'womb']"
MS-TS-AR-00041-00055,Medical,0500-01-01,1899-12-31,"Leaves from a medical work dealing generally with pathology and touching here upon various ailments: headache, rotting of limbs, kidney diseases, diuretics, leprosy, dropsy, paralysis, itching, and sciatica.","['ailment', 'disease', 'diuretic', 'headache', 'itching', 'kidney', 'leprosy', 'limb', 'medical', 'paralysis', 'pathology', 'rotting', 'sciatica']"
MS-TS-AR-00041-00060,Medical,0500-01-01,1899-12-31,"Bifolium from a medical work dealing with various pathologies: vomit caused by severe coughing and by stomach problems; mental and physical exhaustion and their different features; fevers, colics, hiccups and headaches.","['caused', 'colic', 'coughing', 'exhaustion', 'fever', 'headache', 'hiccup', 'medical', 'mental', 'pathology', 'stomach', 'vomit']"
MS-TS-AR-00041-00061,Medical,0500-01-01,1899-12-31,"Leaf from a book on materia medica, here describing the properties and use of absinth, cassia, manna, violet, common fumitory, and field bindweed mixed with water and honey.","['absinth', 'bindweed', 'cassia', 'fumitory', 'honey', 'manna', 'medica', 'violet', 'water']"
MS-TS-AR-00041-00062,Medical; philosophical,0500-01-01,1899-12-31,Bifolium from an unidentified work dealing with the soul and the faculties of the body.,['body']
MS-TS-AR-00041-00063,Medical,0500-01-01,1899-12-31,"Introduction and first three chapters of Amīn al-Dawla Abū al-Ḥasan Hibat Allāh ibn Saʿīd (known as al-Tilmīḏ), Maqālah fī l-faṣd (‘On phlebotomy’; ed. Aleppo 1997).","['hibat', 'phlebotomy']"
MS-TS-AR-00041-00066,Medical,0500-01-01,1899-12-31,"Part of a poem dealing with sexual medicine: aphrodisiacs, excessive frequency of erections and premature ejaculation‫.‬ The structure seems to be similar to Avicenna, Urjūza fī l-ṭibb (‘Poem on medicine’), but there are no clearly parallel passages. Belongs with T-S Ar.41.97.","['aphrodisiac', 'ejaculation\u202b.\u202c', 'excessive', 'medicine', 'premature', 'sexual']"
MS-TS-AR-00041-00075,Medical,0500-01-01,1899-12-31,Collection of four recipes for preparing aphrodisiacs.,"['aphrodisiac', 'preparing']"
MS-TS-AR-00041-00078,Medical,0500-01-01,1899-12-31,"Passage from ‘Alī ibn al-‘Abbās al-Majūsī, Kāmil al-ṣināʿa al-ṭibbiyya (‘The complete book of the medical art’): from the Second Discourse of the Second Part, chapters 7-8 (ed. Būlāq 1877, II: 341-342): treatment of the heart in pain and of loss of appetite. The opening of chapter 8 is found at the bottom of verso.","['appetite', 'bottom', 'heart', 'medical', 'pain', 'treatment']"
MS-TS-AR-00041-00080,Medical,0500-01-01,1899-12-31,"From a medical treatise dealing with the balancing of humours in the human body, and with the tempered body. A suggested rebalancing treatment includes the ingredients fennel, hemlock, rheum plant and gum.","['balancing', 'body', 'fennel', 'gum', 'hemlock', 'human', 'humour', 'medical', 'plant', 'rheum', 'treatment']"
MS-TS-AR-00041-00090,Medical,0500-01-01,1899-12-31,"Leaf from a book on pharmacopoeia, including two recipes using balsam seeds, saffron, nard, gypsophila struthium, peppers, silk worm cocoons, lichen, colocynth, camphor, caraway, sugar, cinnamon, camphor, castor, Indian salt, cow and wolf bile, oil of Indian nard, and lupines.","['balsam', 'bile', 'camphor', 'caraway', 'castor', 'cinnamon', 'cocoon', 'colocynth', 'cow', 'gypsophila', 'lichen', 'lupine', 'nard', 'oil', 'pepper', 'pharmacopoeia', 'saffron', 'salt', 'silk', 'struthium', 'sugar', 'wolf', 'worm']"
MS-TS-AR-00041-00094,Medical; jottings,0500-01-01,1899-12-31,"Leaf (possibly a draft) from a medico-philosophical work, here dealing with the humours, the various organs of the body and in particular the brain. Verso contains Arabic jottings.","['body', 'brain', 'humour', 'medico-philosophical', 'organ']"
MS-TS-AR-00041-00096,Medical,0500-01-01,1899-12-31,"Leaf from a book on pharmacopeia, based on recipes found in Avicenna, Al-qanūn fī l-ṭibb (‘Canon of medicine’; ed. Būlāq 1871, III: 302-303). Simples mentioned include: wheat flour, chickpeas, white rice, poppy seeds, almonds, semolina, white sugar, milk, fat, butter, broad bean flour, lentils, mung beans, sesame, raisins, cardamon, rose, and secacul.","['almond', 'bean', 'butter', 'cardamon', 'chickpea', 'fat', 'flour', 'lentil', 'medicine', 'milk', 'mung', 'pharmacopeia', 'poppy', 'raisin', 'rice', 'rose', 'secacul', 'semolina', 'sesame', 'sugar', 'wheat']"
MS-TS-AR-00041-00097,Medical,0500-01-01,1899-12-31,"Poem on medicine, dealing with different kinds of fevers and the symptoms that are associated with them, including headache, anxiety and hotness. Belongs with T-S Ar.41.66.","['anxiety', 'fever', 'headache', 'hotness', 'medicine']"
MS-TS-AR-00041-00104,Medical,0500-01-01,1899-12-31,"Leaf from a medical work focussing on diarrhoea and how to cure it. Rest, drink and food are considered beneficial, while the appearance of vomit is to be considered dangerous for the patient. Suggested treatment includes the use of bole from Khurasan, quince, rose and barley waters, vinegar, pomegranate juice, rue, mint, and celery.","['barley', 'celery', 'cure', 'diarrhoea', 'food', 'juice', 'medical', 'mint', 'patient', 'pomegranate', 'quince', 'rest', 'rose', 'treatment', 'vinegar', 'vomit', 'water']"
MS-TS-AR-00041-00106,Medical,0500-01-01,1899-12-31,"Medico-philosophical work dealing with general topics of humoral medicine, the temperaments, the essential moisture and heat in the body. Reference is made to Avicenna, who is here called al-Šayḵ.","['body', 'heat', 'medicine', 'medico-philosophical']"
MS-TS-AR-00041-00110,Medical,0500-01-01,1899-12-31,"Part of a medical recipe, listing among its ingredients grape juice, lemon water and bran water.","['bran', 'grape', 'juice', 'lemon', 'medical', 'water']"
MS-TS-AR-00041-00113,Medical,0500-01-01,1899-12-31,"Part of an unidentified medical work, here preserving the rubricated heading of chapter 18, dealing with urinary passages and problems with the urinary system.","['medical', 'urinary']"
MS-TS-AR-00041-00114,Medical,0500-01-01,1899-12-31,"Fragment from a work on pharmacopoeia, presenting a series of recipes for pastes with different aims: increase of sexual appetite, cure of coughing, relief of toothache, and treatment of colics.","['appetite', 'colic', 'coughing', 'cure', 'pharmacopoeia', 'relief', 'sexual', 'toothache', 'treatment']"
MS-TS-AR-00041-00115,Medical,0500-01-01,1899-12-31,"Bifolium of a composite text, divided into chapters dealing with the preparation and dyeing of textiles, and animal behaviour. Descriptions of materia medica are found interspersed in the text.","['animal', 'medica', 'preparation']"
MS-TS-AR-00041-00116,Medical,0500-01-01,1899-12-31,"Part of a work on toxicology, including the openings of chapters 13 and 14, dealing with the cure of animal bites and stings, with topical applications of medicaments to calm pain and swellings. Theriac and phlebotomy are the suggested treatments. Hippocrates, Galen and Soranus of Ephesus are quoted as authorities.","['animal', 'bite', 'cure', 'galen', 'hippocrates', 'medicament', 'pain', 'phlebotomy', 'sting', 'swelling', 'theriac', 'topical', 'toxicology', 'treatment']"
MS-TS-AR-00041-00118,Medical,0500-01-01,1899-12-31,"Leaves from a work on materia medica dealing with the nutrient and curative value of butter, cheese, clarified butter, mineral waters and various oils. Reference is made to a variety of illnesses: obstruction of the liver and of the kidneys, asthma, piles, gout, swollen groin, and swollen ear lobes.","['asthma', 'butter', 'cheese', 'clarified', 'curative', 'ear', 'gout', 'groin', 'illness', 'kidney', 'liver', 'lobe', 'medica', 'mineral', 'nutrient', 'obstruction', 'oil', 'pile', 'swollen', 'water']"
MS-TS-AR-00041-00120,Medical,0500-01-01,1899-12-31,"Leaf from an ophthalmological treatise dealing with the anatomy of the eye, its different layers, and the humours that run through it.","['anatomy', 'eye', 'humour', 'ophthalmological']"
MS-TS-AR-00041-00123,Medical,0500-01-01,1899-12-31,"Part of a treatise on pharmacopoeia describing the preparation of different syrups and medicaments, their uses and effectiveness for treating illnesses such as epilepsy, colics, vomiting, ulcers in the intestines and pain in the liver. The fragment mentions Galen, Māsarjawayh, Yūḥannā ibn Māsawayh, Al-Rāzī and Sābūr ibn Sahl.","['colic', 'effectiveness', 'galen', 'illness', 'intestine', 'liver', 'medicament', 'pain', 'pharmacopoeia', 'preparation', 'syrup', 'treating', 'ulcer', 'vomiting']"
MS-TS-AR-00041-00128,Medical,0500-01-01,1899-12-31,"Discussion of fevers based on Avicenna, Al-qanūn fī l-ṭibb (‘Canon of medicine’; ed. Būlāq 1871, III: 2-3).","['fever', 'medicine']"
MS-TS-AR-00041-00130,Medical,0500-01-01,1899-12-31,"Passages from Ibn Al-Bayṭār, Al-jāmiʿ li-mufradāt (‘Compendium of simples’), comprising simples beginning with the letters lām and mīm (ed. Būlāq 1874, IV: 121-123). Belongs with T-S Ar.41.138.",[]
