classmark,title,date_from,date_to,summary,medical_terms
MS-TS-AR-00043-00324,Medical,0500-01-01,1899-12-31,"Leaf from a work on dermatology, dealing with skin diseases on the authority of al-Ṭabarī and al-Rāzī; with alopecia, quoting Galen; and with corns and methods for removing them.","['alopecia', 'corn', 'dermatology', 'disease', 'galen', 'skin']"
MS-TS-AR-00043-00325,Medical,0500-01-01,1899-12-31,"Judaeo-Arabic version of ʿAlī ibn ʿĪsā, Taḏkirat al-kaḥḥālīn (‘Memorandum for opticians’), second discourse, table of contents (ed. Hyderabad 1964, pp. 39-45).",['optician']
MS-TS-AR-00043-00328,Medical,0500-01-01,1899-12-31,"Leaf from Solomon ibn Tibbon’s Hebrew translation of Maimonides’ commentary on Hippocrates, Aphorisms I: 24-II: 5 (ed. Müntner 1961, pp. 29-32).","['aphorism', 'hippocrates', 'müntner']"
MS-TS-AR-00043-00336,Medical,0500-01-01,1899-12-31,"Medico-mystical text dealing with anatomy of the guts in relationship to their mystical meanings: stomach, intestines, liver, spleen and kidneys. The fragment preserves a quotation from Psalms 139:13 and 114:1.","['anatomy', 'gut', 'intestine', 'kidney', 'liver', 'medico-mystical', 'mystical', 'spleen', 'stomach']"
MS-TS-AR-00043-00340,Medical,0500-01-01,1899-12-31,"Leaf from a theoretical medical work dealing with the composition of the body and its functions: bodily moisture, mineral composition of the body, pneumata and internal senses, and faculties of the body.","['bodily', 'body', 'medical', 'mineral', 'pneumata']"
MS-TS-AR-00044-00001,Medical,0500-01-01,1899-12-31,"Leaf from ʿAlī ibn ʿĪsā, Taḏkirat al-kaḥḥālīn (‘Memorandum for opticians’), second discourse, end of chapter 22 and beginning of chapter 23, dealing with stye and hypopyon (ed. Hyderabad 1964, pp. 132-133).","['hypopyon', 'optician', 'stye']"
MS-TS-AR-00044-00005,Medical,0500-01-01,1899-12-31,Bifolium from a medical treatise focussing on the definition of health and disease and on the reasons for why Egypt is particularly susceptible to pestilence.,"['disease', 'health', 'medical']"
MS-TS-AR-00044-00008,Medical,0500-01-01,1899-12-31,"Leaf from a Judaeo-Arabic medical work, dealing with the anatomy and physiology of the eye: the eyelids, conjunctiva and the treatment of pannus.","['anatomy', 'conjunctiva', 'eye', 'eyelid', 'medical', 'pannus', 'physiology', 'treatment']"
MS-TS-AR-00044-00009,Medical; philosophical,0500-01-01,1899-12-31,"Bifolium from a medico-philosophical work dealing with the faculties of the body and its natural heath. It includes a discussion on the curability of serious diseases, like tuberculosis, lung damage and wounds.","['body', 'curability', 'disease', 'heath', 'lung', 'medico-philosophical', 'tuberculosis', 'wound']"
MS-TS-AR-00044-00010,Medical,0500-01-01,1899-12-31,"Leaf from a booklet on materia medica, listing simples and their uses.",['medica']
MS-TS-AR-00044-00011,Medical,0500-01-01,1899-12-31,"Leaf from an ophthalmological work, presented in the form of questions and answers: the brain and the meninges, the retina and the constituent parts of the eye.","['brain', 'eye', 'meninges', 'ophthalmological', 'retina']"
MS-TS-AR-00044-00012,Medical; grammar; philosophy,0500-01-01,1899-12-31,"The three fragments do not appear to belong together. P1: grammatical discussion on letters and interpretation of texts, with mention of ‘The Ancients’; P2: bifolium from a philosophical-theological work dealing with ethics; P3: leaf from a work on materia medica, preserving a descriptive chart with names of medical plants and their uses on recto, and a further table of simple remedies on verso.","['medica', 'medical', 'plant', 'remedy']"
MS-TS-AR-00044-00013,Medical,0500-01-01,1899-12-31,"Leaf from a Judaeo-Arabic version of ʿAlī ibn ʿĪsā, Taḏkirat al-kaḥḥālīn (‘Memorandum for opticians’), second discourse, chapters 22-29 (ed. Hyderabad 1964, pp. 132-133).",['optician']
MS-TS-AR-00044-00030,Medical,0500-01-01,1899-12-31,"Bifolium from a medical work, dealing with gynaecological remedies, like emmenagogues for increasing the menstrual flow, and drugs to cause abortions.","['abortion', 'cause', 'drug', 'emmenagogue', 'gynaecological', 'medical', 'menstrual', 'remedy']"
MS-TS-AR-00044-00031,Medical,0500-01-01,1899-12-31,"Bifolium from an ophthalmological work, presented in the form of questions and answers, here dealing with vision, the vital spirit residing in the brain, diseases of the eye, eyelids and eyelashes. Belongs with T-S Ar.44.11.","['brain', 'disease', 'eye', 'eyelash', 'eyelid', 'ophthalmological', 'vision']"
MS-TS-AR-00044-00032,Medical,0500-01-01,1899-12-31,"Bifolium from a Judaeo-Arabic version of Ibn Al-Nafīs’ commentary on Hippocrates, Aphorisms, I: 2, 6-7 (ed. ʿAbd al-Qādir Muḥammad ʿAlī and Y. Zaydān 1987, pp. 96-97; 109-111).","['aphorism', 'hippocrates']"
MS-TS-AR-00044-00037,Medical,0500-01-01,1899-12-31,"Leaf from a booklet on pharmacopeia, presenting recipes for treating chest and respiratory ailments. It includes the preparation of a potion made of manna.","['ailment', 'chest', 'manna', 'pharmacopeia', 'potion', 'preparation', 'respiratory', 'treating']"
MS-TS-AR-00044-00040,Medical,0500-01-01,1899-12-31,"Bifolium from a Judaeo-Arabic version of ʿAlī ibn ʿĪsā, Taḏkirat al-kaḥḥālīn (‘Memorandum for opticians’), first discourse, chapter 14, heading of chapter 15, chapter 17 and beginning of chapter 18 (ed. Hyderabad 1964, pp. 26-27, 29-31).",['optician']
MS-TS-AR-00044-00048,Medical,0500-01-01,1899-12-31,"Opening of a medical text attributed to Eli b. Abraham, here focussing on general definitions of medicine, health and illness and phlebotomy.","['health', 'illness', 'medical', 'medicine', 'phlebotomy']"
MS-TS-AR-00044-00049,Medical,0500-01-01,1899-12-31,"Bifolia from a medical book (possibly a copy for personal use), here dealing with embryology, describing the formation of the foetus in the womb, and with paediatrics, and the practice of cupping and phlebotomy on children.","['child', 'cupping', 'embryology', 'foetus', 'medical', 'paediatrics', 'phlebotomy', 'womb']"
MS-TS-AR-00044-00051,Medical,0500-01-01,1899-12-31,"Autograph leaf from Maimonides’ epitome of Galen, ‘On the faculty of foods’ (ed. Stern, III: 15-17).","['food', 'galen']"
MS-TS-AR-00044-00056,Medical; philosophical,0500-01-01,1899-12-31,"Leaf from a medico-philosophical work, here dealing with general medical topics: the faculties and functions of the organs in the body; humours and temperaments; innate human heath.","['body', 'heath', 'human', 'humour', 'medical', 'medico-philosophical', 'organ']"
MS-TS-AR-00044-00057,Medical,0500-01-01,1899-12-31,"Bifolium from a medical work, dealing with fevers and how to treat patients suffering from them. Galen is mentioned.","['fever', 'galen', 'medical', 'patient', 'suffering', 'treat']"
MS-TS-AR-00044-00060,Medical,0500-01-01,1899-12-31,"Leaf from a work on materia medica, listing simples useful for treating stomach ache, indigestion and excessive production of bile. The fragment also deals with fruit in the diet of patients.","['ache', 'bile', 'diet', 'excessive', 'fruit', 'indigestion', 'medica', 'patient', 'stomach', 'treating']"
MS-TS-AR-00044-00061,Medical,0500-01-01,1899-12-31,"Leaf from an ophthalmological work, presented in the form of questions and answers, and here focussing on illnesses that may affect the eyelids: abscesses, hardening and thickening of the eyelids. The material is taken from ʿAlī ibn ʿĪsā, Taḏkirat al-kaḥḥālīn (‘Memorandum for opticians’; ed. Hyderabad 1964, pp. 124-126).","['abscess', 'eyelid', 'hardening', 'illness', 'ophthalmological', 'optician']"
MS-TS-AR-00044-00064,Medical,0500-01-01,1899-12-31,"From a theoretical medical work dealing with the four temperaments, the faculties of the body, the soul and the definition of what constitutes an illness.","['body', 'illness', 'medical']"
MS-TS-AR-00044-00065,Medical; astrological,0500-01-01,1899-12-31,"Bifolium from an astrological text addressing medical problems: the signs of the zodiac and their influence on health, on the emergence of illnesses and feelings of fear.","['astrological', 'fear', 'health', 'illness', 'medical']"
MS-TS-AR-00044-00069,Medical,0500-01-01,1899-12-31,"Bifolium from ʿAlī ibn ʿĪsā, Taḏkirat al-kaḥḥālīn (‘Memorandum for opticians’), second discourse, chapters 3 and 4 (ed. Hyderabad 1964, pp. 75ff.).",['optician']
MS-TS-AR-00044-00070,Medical,0500-01-01,1899-12-31,"Bifolium from a Judaeo-Arabic medical work, focussing on the management of patients and on general treatment of illnesses. Galen is mentioned on f. 2v.","['galen', 'illness', 'medical', 'patient', 'treatment']"
MS-TS-AR-00044-00073,Medical; philosophical,0500-01-01,1899-12-31,"Bifolium from a theoretical medico-philosophical work, dealing with the differences between humans and other animals, the four elements and their connection to the four humours, the innate heat of the body.","['animal', 'body', 'heat', 'human', 'humour', 'medico-philosophical']"
MS-TS-AR-00044-00074,Medical; letter,0500-01-01,1899-12-31,"Two bifolia from a Judaeo-Arabic version of Hippocrates, Aphorisms, partially covering section I, dealing with topics of general medical theory.","['aphorism', 'hippocrates', 'medical']"
MS-TS-AR-00044-00075,Medical,0500-01-01,1899-12-31,"Bifolium from a Judaeo-Arabic version of Hippocrates, Aphorisms, partially covering section II, dealing with sleep, nourishment, excretion and crises of illness.","['aphorism', 'excretion', 'hippocrates', 'illness', 'nourishment', 'sleep']"
MS-TS-AR-00044-00076,Medical,0500-01-01,1899-12-31,"Leaves from a work on pharmacopoeia with a description of various medical preparations, in no apparent order or with no single aim. Recipes are separated with a circular symbol and open with the phrases: ṣifa al- (‘description of’); wa-aḵar (‘and another recipe’) and ṣināʿat (‘the making of’).","['medical', 'pharmacopoeia', 'preparation']"
MS-TS-AR-00044-00077,Medical,0500-01-01,1899-12-31,"Two bifolia from a medical work dealing with the different types of fevers, their causes, symptoms, treatments, and times of development. Changes in the humours in case of fever and the best diet during treatment.","['cause', 'diet', 'fever', 'humour', 'medical', 'treatment']"
MS-TS-AR-00044-00078,Medical,0500-01-01,1899-12-31,"Leaf from a theoretical medical work dealing with the humours, temperaments, and mentioning bodily moisture and sweat.","['bodily', 'humour', 'medical', 'sweat']"
MS-TS-AR-00044-00079,Medical; autograph,0500-01-01,1899-12-31,"Autograph leaves of Maimonides, Treatise on sexual intercourse.","['intercourse', 'sexual']"
MS-TS-AR-00044-00080,Medical,0500-01-01,1899-12-31,"Leaf from a medico-philosophical work, dealing with both medical theory and pathology, describing jaundice, diabetes, stones in urine and fevers. Galen is mentioned in the theoretical part. Verso includes the beginning of one recipe in Arabic script.","['diabetes', 'fever', 'galen', 'jaundice', 'medical', 'medico-philosophical', 'pathology', 'urine']"
MS-TS-AR-00044-00082,Medical,0500-01-01,1899-12-31,"Leaf from a philosophical work, dealing with the senses and sensation, the body’s reactions to stimuli, and the rational faculty.","['body', 'stimulus']"
MS-TS-AR-00044-00083,Medical,0500-01-01,1899-12-31,"Leaf from a Judaeo-Arabic medical work, dealing with the anatomy, physiology and pathology of the lungs, and, in particular, breathing, diseases of the lungs, ulcerations of the lung tissues, and problems related to the treatment of affected lungs.","['anatomy', 'breathing', 'disease', 'lung', 'medical', 'pathology', 'physiology', 'tissue', 'treatment', 'ulceration']"
MS-TS-AR-00044-00084,Medical; philosophical,0500-01-01,1899-12-31,"Passage from a medico-philosophical work, describing the faculties of the human body; its composition, and the four humours. A few words in Arabic script are used within the main Judaeo-Arabic text.","['body', 'human', 'humour', 'medico-philosophical']"
MS-TS-AR-00044-00085,Medical,0500-01-01,1899-12-31,"Bifolium from a medical work presented in the form of questions and answers. The text focuses mostly on eye diseases, using material derived from ʿAlī ibn ʿĪsā, Taḏkirat al-Kaḥḥālīn (‘Memorandum for opticians’).","['disease', 'eye', 'medical', 'optician']"
MS-TS-AR-00044-00086,Medical,0500-01-01,1899-12-31,"Page from a medical work dealing with the management of patients, here focussing on patients with lung problems and their management through diet, bathing, drugs and cough syrups.","['bathing', 'cough', 'diet', 'drug', 'lung', 'medical', 'patient', 'syrup']"
MS-TS-AR-00044-00090,Medical,0500-01-01,1899-12-31,"Bifolium from a work on materia medica, presenting a series of simples and recipes for combining them. The simples include pepper, manna, ginger, bread, olive oil, and milk.","['bread', 'ginger', 'manna', 'medica', 'milk', 'oil', 'olive', 'pepper']"
MS-TS-AR-00044-00091,Medical,0500-01-01,1899-12-31,"Two bifolia from a Judaeo-Arabic medical work, dealing with throat inflammations, ailments of the uvula, abscesses of the tonsils, and diphtheria. The fragment also includes a description of medical recipes.","['abscess', 'ailment', 'diphtheria', 'inflammation', 'medical', 'tonsil', 'uvula']"
MS-TS-AR-00044-00093,Medical,0500-01-01,1899-12-31,"Leaf from a medical work focussing of different types of inflammation and their treatment. It mentions Hippocrates and Galen, whose names appear in Arabic script. Arabic phrases are interspersed within the main Judaeo-Arabic text.","['galen', 'hippocrates', 'inflammation', 'medical', 'treatment']"
MS-TS-AR-00044-00094,Medical,0500-01-01,1899-12-31,"Leaf from a medical work dealing with fevers, diseases of the chest and lungs and liver.","['chest', 'disease', 'fever', 'liver', 'lung', 'medical']"
MS-TS-AR-00044-00099,Medical,0500-01-01,1899-12-31,"Leaf from a Judaeo-Arabic version of Avicenna, Al-qanūn fī l-ṭibb (‘Canon of medicine’), dealing with medicine that helps increase the hotness, coldness, moisture and dryness of the body, according to the general humoral theory (ed. Būlāq 1871, I: 104-105).","['body', 'coldness', 'dryness', 'hotness', 'medicine']"
MS-TS-AR-00044-00101,Medical,0500-01-01,1899-12-31,"Bifolium from a medical work, dealing with the seasons of the year and the different ailments that are more common during each of them. The text follows the general Galenic theory of the temperaments.","['ailment', 'medical']"
MS-TS-AR-00044-00121,Medical,0500-01-01,1899-12-31,Bifolium from a medical work dealing with sexual intercourse and the reaction of different temperaments during sex. The fragment also gives a list of medicaments useful for balancing temperaments relating to sexual intercourse.,"['balancing', 'intercourse', 'medical', 'medicament', 'sex', 'sexual']"
MS-TS-AR-00044-00127,Medical; magical,0500-01-01,1899-12-31,"Bifolium from a medico-magical booklet, preserving drawings of magical triangles with successively shortened names of angels (f. 2v) and magical characteres (f. 1v). The text contains elements of popular medicine, and identifies the origin of illnesses with the intervention of supernatural forces.","['illness', 'magical', 'medicine', 'medico-magical']"
MS-TS-AR-00044-00129,Medical,0500-01-01,1899-12-31,"Leaf from a work on materia medica, dealing with simples and instruments whose names begin with the letter ḥā’ and their uses: the use of scales, management of heat in the preparation of drugs, African rue, soil, and pepper cress.","['cress', 'drug', 'heat', 'medica', 'pepper', 'preparation', 'scale']"
MS-TS-AR-00044-00130,Medical,0500-01-01,1899-12-31,"Bifolium from the Arabic version of Avicenna, Al-qanūn fī l-ṭibb (‘Canon of medicine’), dealing with the different kinds of headache (ed. Būlāq 1871, II: 37-39).","['headache', 'medicine']"
MS-TS-AR-00044-00139,Medical,0500-01-01,1899-12-31,"Page from a medical work focussing on Galen’s ‘non-naturals’: the influence of different foods, climate and quality of air on health with a discussion of the differing features of locations at the four cardinal points.","['air', 'food', 'galen', 'health', 'medical']"
MS-TS-AR-00044-00147,Medical,0500-01-01,1899-12-31,"Two pages from a Judaeo-Arabic version of ʿAlī ibn ʿĪsā, Taḏkirat al-Kaḥḥālīn (‘Memorandum for opticians’), second discourse, chapters 14-15 and 139-43 (ed. Hyderabad 1964, pp. 114-7; 139-143).",['optician']
MS-TS-AR-00044-00148,Medical,0500-01-01,1899-12-31,Leaf from a medical work dealing with palpitations caused by excessive heat in the body and their treatment; list of simples and their uses; beginning of a chapter on the liver and its ailments.,"['ailment', 'body', 'caused', 'excessive', 'heat', 'liver', 'medical', 'palpitation', 'treatment']"
MS-TS-AR-00044-00149,Medical,0500-01-01,1899-12-31,Page from a medical work focussing on the anatomy of the liver and its pathology and treatment. The beginning of a ‘Third chapter on the liver and its illnesses’ is found on verso. Recto contains recipes and descriptions of materia medica.,"['anatomy', 'illness', 'liver', 'medica', 'medical', 'pathology', 'treatment']"
MS-TS-AR-00044-00150,Medical,0500-01-01,1899-12-31,"Page from a Judaeo-Arabic version of ʿAlī ibn ʿĪsā, Taḏkirat al-Kaḥḥālīn (‘Memorandum for opticians’), second discourse, chapters 9 and 10 (whose headings are written in large square script), on trichiasis, inversion or ingrowth of eyelids (ed. Hyderabad 1964, pp. 96-99).","['eyelid', 'ingrowth', 'optician', 'trichiasis']"
MS-TS-AR-00044-00151,Medical,1200-01-01,1200-12-31,"Leaf from a Judaeo-Arabic version of ʿAlī ibn ʿĪsā, Taḏkirat al-Kaḥḥālīn (‘Memorandum for opticians’), end of first discourse and beginning of second discourse (ed. Hyderabad 1964, pp. 39-42). The end of the first discourse preserves a note by the copyist that records that the manuscript was copied in Cairo in the year 1511 of the Seleucid era, corresponding to the year 1200 CE.",['optician']
MS-TS-AR-00044-00152,Medical,0500-01-01,1899-12-31,Bifolium from an Arabic medical work on pathology. Includes the beginning of the first chapter (faṣl) and the opening of the second section (bāb).,"['medical', 'pathology']"
MS-TS-AR-00044-00153,Medical,0500-01-01,1899-12-31,"Leaf from an alphabetically arranged lexicon of materia medica, here listing simples under letter ‘bā’’ and their medicinal uses. The simples include saponous plants, beans, onion, and urine. The text includes quotations from Ibn Māsawayh.","['bean', 'medica', 'medicinal', 'onion', 'plant', 'urine']"
MS-TS-AR-00044-00166,Medical,0500-01-01,1899-12-31,"Leaf from a Judaeo-Arabic version of ʿAlī ibn ʿĪsā, Taḏkirat al-Kaḥḥālīn (‘Memorandum for opticians’), from the first discourse, chapters 16-19 (ed. Hyderabad 1964, pp. 29-33).",['optician']
MS-TS-AR-00044-00170,Medical,0500-01-01,1899-12-31,"Bifolium from a Judaeo-Arabic version of ʿAlī ibn ʿĪsā, Taḏkirat al-Kaḥḥālīn (‘Memorandum for opticians’), from the first discourse, chapters 15-17 and beginning of the second discourse (ed. Hyderabad 1964, pp. 27-30, 51-55).",['optician']
MS-TS-AR-00044-00181,Medical,0500-01-01,1899-12-31,"Collection of remedies probably from a medical notebook for personal use, dealing with the treatment of haemorrhoids and bleeding from the rectum.","['bleeding', 'haemorrhoid', 'medical', 'remedy', 'treatment']"
MS-TS-AR-00044-00182,Medical,0500-01-01,1899-12-31,"Leaf from a work on materia medica, with recipes (mostly for potions and syrups) derived from fruits: apricot, quince and carob.","['apricot', 'carob', 'fruit', 'medica', 'potion', 'quince', 'syrup']"
MS-TS-AR-00044-00187,Medical,0500-01-01,1899-12-31,"Leaf from a work on pharmacopoeia describing the preparation of remedies for indigestion, haemorrhoids, palpitation, relaxed bowels and general ailments of the womb. Mention is made of Ḥunayn ibn Isḥāq.","['ailment', 'bowel', 'haemorrhoid', 'indigestion', 'palpitation', 'pharmacopoeia', 'preparation', 'relaxed', 'remedy', 'womb']"
MS-TS-AR-00044-00190,Medical; halaḵa,0500-01-01,1899-12-31,"Bifolium from a work on women’s hygiene, focussing on the management of women suffering from vaginal discharge and bleeding. The text refers to rabbinical laws on purity.","['bleeding', 'hygiene', 'purity', 'suffering', 'vaginal']"
MS-TS-AR-00044-00193,Medical,0500-01-01,1899-12-31,"Bifolium from a work on pharmacopoeia describing preparations for treating fevers, colics and air in the abdomen through enemas, pessaries, suppositories, gargles and snuffs.","['abdomen', 'air', 'colic', 'enema', 'fever', 'gargle', 'pessary', 'pharmacopoeia', 'preparation', 'snuff', 'suppository', 'treating']"
MS-TS-AR-00044-00201,Medical; mysticism,0500-01-01,1899-12-31,"Folio 1r: medical recipe with ingredients such as saffron, honey, and Levantine apples, chebulic myrobalan, and bamboo. Apples are praised as a simple food capable of restoring wellbeing and happiness. The fragment includes stories of lives of sufis and of drugs that cause elation taken from Badr al-Dīn Muẓaffar, Mufarriḥ al-Nafs (‘The soul-cheerer’; 13th century). There is mention of Sihāb al-Dīn ʿUmar al-Šuhrawardī, ʿAwārif al-maʿārif (‘The knowledge of the spiritually learned’).","['apple', 'bamboo', 'cause', 'chebulic', 'drug', 'elation', 'food', 'happiness', 'honey', 'levantine', 'life', 'medical', 'mufarriḥ', 'myrobalan', 'restoring', 'saffron', 'wellbeing']"
MS-TS-AR-00044-00204,Medical,0500-01-01,1899-12-31,"Nine leaves from a work on materia medica, detailing names of simples, their features and medicinal uses. Simples treated include olives, fumaria, aromatic plants, iris, carrot, and other vegetable foodstuffs.","['carrot', 'foodstuff', 'fumaria', 'iris', 'medica', 'medicinal', 'olive', 'plant', 'treated', 'vegetable']"
MS-TS-AR-00044-00205,Medical,0500-01-01,1899-12-31,"Two leaves from a work on pharmacopoeia, describing the preparation of potions, robs, tablets and aperients.","['aperient', 'pharmacopoeia', 'potion', 'preparation', 'tablet']"
MS-TS-AR-00044-00206,Medical; astrological,0500-01-01,1899-12-31,"Astrological-medical text relating the abundance of crops and health or their opposite, according to the position of the moon relative to the planets.","['astrological-medical', 'health', 'moon']"
MS-TS-AR-00044-00208,Medical,0500-01-01,1899-12-31,"Leaf from a work on fevers, dealing in particular with the treatment of acute, recurring and pestilential fevers and their symptoms, like headache, cough and excessive thirst.","['cough', 'excessive', 'fever', 'headache', 'pestilential', 'thirst', 'treatment']"
MS-TS-AR-00044-00209,Medical,0500-01-01,1899-12-31,"Two leaves from a medical notebook, possibly for personal use, dealing with diseases of the bladder and kidneys, urinal problems, haemorrhoids, colics and ascites. Galen, Al-Rāzī, al-Ṭabarī and Hippocrates are mentioned.","['ascites', 'bladder', 'colic', 'disease', 'galen', 'haemorrhoid', 'hippocrates', 'kidney', 'medical', 'urinal']"
MS-TS-AR-00044-00210,Medical,0500-01-01,1899-12-31,"Leaf from a medical work in Hebrew with some vocabulary in Ladino, focussing on fevers, their different kinds and their treatment. The extant text describes the use of baths and of drinking medical potions.","['bath', 'fever', 'medical', 'potion', 'treatment']"
MS-TS-AR-00044-00215,Medical,0500-01-01,1899-12-31,"Part of a leaf from a medical work, focussing on fevers and, in particular, on septic fevers, their symptoms and their management through food, drinks and baths.","['bath', 'fever', 'food', 'medical', 'septic']"
MS-TS-AR-00044-00218,Medical,0500-01-01,1899-12-31,"Leaves from a work on materia medica, arranged in alphabetical order. Items presented here begin with the letters mīm and nūn and include ammoniac salt, borax, celery seeds, and cumin. Names of entries are copied outside the margins for ease of consultation; occasionally their main qualitative features are also reported in the margins (for example, ‘wet to the second degree’, P2, f. 2r).","['ammoniac', 'borax', 'celery', 'cumin', 'medica', 'nūn', 'salt']"
MS-TS-AR-00044-00222,Medical,0500-01-01,1899-12-31,"Notes on materia medica, possibly for personal use. The fragment opens with a basmala in large script, and lists simples and their uses. The text includes the preparation of a potion with white pepper, manna, and sugar.","['basmala', 'manna', 'medica', 'pepper', 'potion', 'preparation', 'sugar']"
MS-TS-AR-00045-00003,Medical,0500-01-01,1899-12-31,"Bifolium from an anatomical work, focussing on the brain, the pneumata and their positioning within the brain, the heart and the liver; the fragment also deals with pulse and respiration.","['anatomical', 'brain', 'heart', 'liver', 'pneumata', 'pulse', 'respiration']"
MS-TS-AR-00045-00004,Medical,0500-01-01,1899-12-31,"Fragment of a medical work, discussing thirst, its different causes, and presenting recipes for quenching potions.","['cause', 'medical', 'potion', 'thirst']"
MS-TS-AR-00045-00010,Medical,0500-01-01,1899-12-31,Fragment of a leaf from a medical work dealing with pathologies of the liver and the stomach along with colds and the treatment of stomach ache and wind.,"['ache', 'cold', 'liver', 'medical', 'pathology', 'stomach', 'treatment']"
MS-TS-AR-00045-00013,Medical,0500-01-01,1899-12-31,"Part of a leaf from a medical work, dealing with the treatment of fever by cold and iced compresses applied to the head of the patient. The text notes that care should be taken in washing and possibly shaving the head before the compresses are applied.","['care', 'cold', 'fever', 'head', 'iced', 'medical', 'patient', 'shaving', 'treatment']"
