classmark,title,date_from,date_to,summary,medical_terms
MS-TS-AS-00180-00012,Medical,0500-01-01,1899-12-31,"Medical texts discussing the faculties, sleep and disease.","['disease', 'medical', 'sleep']"
MS-TS-AS-00180-00016,Medical,0500-01-01,1899-12-31,"Various recipes, such as an embrocation (a balm) for leucoderma, use of anarcardium officiale, cistus ladaniferus, powdered oak, and gum arabic. On verso there are chapter headings in a large, bold script for the different ointments.","['anarcardium', 'balm', 'cistus', 'embrocation', 'gum', 'ladaniferus', 'leucoderma', 'oak', 'ointment', 'powdered']"
MS-TS-AS-00180-00019,Medical,0500-01-01,1899-12-31,"Fragment from a medical text, written somewhat untidily, and mentioning general remedies and epilepsy.","['medical', 'remedy']"
MS-TS-AS-00180-00020,Medical,0500-01-01,1899-12-31,"Page from a medical work on inflammatory swellings, pain in the joints, excess of phlegm and hot swellings, most of which are apparently due to a sedentary life and excess of sexual intercourse.","['excess', 'hot', 'inflammatory', 'intercourse', 'life', 'medical', 'pain', 'phlegm', 'sexual', 'swelling']"
MS-TS-AS-00180-00021,Medical,0500-01-01,1899-12-31,"Discussion of the temperaments, natural and psychological matters.",[]
MS-TS-AS-00180-00032,Medical; list,0500-01-01,1899-12-31,"List of materia medica, including simples such as tamarind, saffron, jujube, berbers, and plums.","['medica', 'plum', 'saffron', 'tamarind']"
MS-TS-AS-00180-00033,Medical,0500-01-01,1899-12-31,"Part of a prescription, with a recipe for external use, containing sugar and sal-ammoniac, wrapped in a woollen cloth.","['cloth', 'prescription', 'sal-ammoniac', 'sugar']"
MS-TS-AS-00180-00041,Medical,0500-01-01,1899-12-31,Text discussing the uses of the roots of aristolochia.,['root']
MS-TS-AS-00180-00043,Medical,0500-01-01,1899-12-31,"Medical text, discussing the examination of urine (colour, consistency and presence of blood) of feverish patients suffering from exhaustion. Chapter headings in larger script.","['blood', 'colour', 'exhaustion', 'feverish', 'medical', 'patient', 'suffering', 'urine']"
MS-TS-AS-00180-00046,Medical,0500-01-01,1899-12-31,"Leaf from an ophthalmological work, discussing the optical nerve.","['nerve', 'ophthalmological', 'optical']"
MS-TS-AS-00180-00052,Medical,0500-01-01,1899-12-31,"Leaf from a medical work, dealing here with the treatment of lice infestation.","['infestation', 'louse', 'medical', 'treatment']"
MS-TS-AS-00180-00059,Medical,0500-01-01,1899-12-31,"Fragment containing part of a medical recipe, which includes simples such as pepper, rose oil, lettuce juice, and gum ammoniac.","['ammoniac', 'gum', 'juice', 'lettuce', 'medical', 'oil', 'pepper', 'rose']"
MS-TS-AS-00180-00062,Medical,0500-01-01,1899-12-31,Text on the general management of diets.,['diet']
MS-TS-AS-00180-00071,Medical,0500-01-01,1899-12-31,Text discussing temperaments.,[]
MS-TS-AS-00180-00076,Medical,0500-01-01,1899-12-31,"Leaf from an ophthalmological work, concerned with the treatment of styes and ulcers with white collyrium (eye wash).","['collyrium', 'eye', 'ophthalmological', 'stye', 'treatment', 'ulcer']"
MS-TS-AS-00180-00134,Medical; magical,0500-01-01,1899-12-31,"Bifolium from a small-format booklet, with various chapter headings. Includes recipes to treat skin complaints and colics.","['colic', 'skin', 'treat']"
MS-TS-AS-00180-00135,Medical; magical,0500-01-01,1899-12-31,"Recto: description of a chapter on childbirth difficulties. Treatment includes the writing of an amulet, the first part of which is inscribed with the šahāda. Verso: description of chapters on treatment of deafness, earache and throbbing headache. Simples used in recipes include violet, pepper, cress seeds, radish seeds and sesame oil.","['childbirth', 'cress', 'deafness', 'earache', 'headache', 'oil', 'pepper', 'radish', 'sesame', 'throbbing', 'treatment', 'violet']"
MS-TS-AS-00180-00162,Medical,0500-01-01,1899-12-31,"Leaf from a medical work, dealing here with dermatology and a recipe for a skin application made of castor oil, olive oil and wax.","['castor', 'dermatology', 'medical', 'oil', 'olive', 'skin', 'wax']"
MS-TS-AS-00180-00163,Medical,0500-01-01,1899-12-31,"Leaf from an ophthalmological work, with instructions of how to prepare a compound of collyrium made of ceruse.","['ceruse', 'collyrium', 'ophthalmological', 'prepare']"
MS-TS-AS-00180-00171,Medical,0500-01-01,1899-12-31,"Medical recipes, one of which comprises pearls, lapis lazuli, saffron, crystalline sugar, liquorice root, gum arabic, and starch.","['gum', 'lapis', 'lazuli', 'liquorice', 'medical', 'pearl', 'root', 'saffron', 'starch', 'sugar']"
MS-TS-AS-00180-00189,Medical; list,0500-01-01,1899-12-31,List of materia medica.,['medica']
MS-TS-AS-00180-00196,Medical,0500-01-01,1899-12-31,"Leaf from a medical work, quoting al-Rāzī and al-Baṣrī.",['medical']
MS-TS-AS-00180-00197,Medical,0500-01-01,1899-12-31,"Leaf from a medical work, quoting Ibn Māsawayh and al-Zahrāwī.",['medical']
MS-TS-AS-00180-00199,Medical; list,0500-01-01,1899-12-31,"List of materia medica, including simples such as celery, false bdellium, turpeth, aloes, sarcocolnla, and wormwood.","['aloe', 'bdellium', 'celery', 'medica', 'sarcocolnla', 'turpeth', 'wormwood']"
MS-TS-AS-00180-00201,Medical,0500-01-01,1899-12-31,"Leaf from a lexicon of materia medica: list of simples starting with zāʾ, their actions and uses.",['medica']
MS-TS-AS-00180-00202,Medical,0500-01-01,1899-12-31,"Medical text, concerned with the general management of sick people, with advice on food, drinks and baths, and on what dissolves phlegm.","['bath', 'food', 'medical', 'phlegm', 'sick']"
MS-TS-AS-00180-00208,Medical,0500-01-01,1899-12-31,"Piece from a work on sexual medicine, mentioning here the corona of the penis and semen.","['corona', 'medicine', 'penis', 'semen', 'sexual']"
MS-TS-AS-00180-00209,Medical,0500-01-01,1899-12-31,"Leaf from a work on sexual medicine, dealing here with what enhances sexual intercourse, mentioning Chinese cinnamon and marrow.","['cinnamon', 'intercourse', 'marrow', 'medicine', 'sexual']"
MS-TS-AS-00180-00210,Medical,0500-01-01,1899-12-31,"Leaf from a work on sexual medicine, dealing here with the erection and aphrodisiacs. Simples mentioned include hyacinth and the fruit of the ash tree.","['aphrodisiac', 'ash', 'fruit', 'hyacinth', 'medicine', 'sexual', 'tree']"
MS-TS-AS-00180-00227,Medical,0500-01-01,1899-12-31,Medical text discussing tachycardia and headache.,"['headache', 'medical', 'tachycardia']"
MS-TS-AS-00180-00230,Medical,0500-01-01,1899-12-31,"Recto: text dealing wth liver disease and those suffering from it, their colour, the nature of their stools and the colour of their urine. Phlebotomy is recommended. Verso: the text deals with sneezing and gasping for breath in the case of those on the point of death.","['breath', 'colour', 'death', 'disease', 'gasping', 'liver', 'phlebotomy', 'sneezing', 'stool', 'suffering', 'urine']"
MS-TS-AS-00180-00231,Medical,0500-01-01,1899-12-31,"Recto: introductory page of a medical work, beginning with the basal and referring to the sayings of the sages, before discussing a recipe for the cleansing of facial skin and resolving puffiness under the eyelids, tetter (a skin disease) and ulcerated scabs. Simples used are mustard, nard, garlic, lard, and olive oil. On verso polite formulae and badly rubbed jottings.","['basal', 'cleansing', 'disease', 'eyelid', 'facial', 'garlic', 'lard', 'medical', 'mustard', 'nard', 'oil', 'olive', 'puffiness', 'rubbed', 'sage', 'scab', 'skin', 'tetter', 'ulcerated']"
MS-TS-AS-00180-00239,Medical,0500-01-01,1899-12-31,"Medical recipes; the recipe in the margin, written in another hand, is for a suppository.","['hand', 'medical', 'suppository']"
MS-TS-AS-00180-00266,Medical,0500-01-01,1899-12-31,"Medical text on the management of a disease that affects the yellow bile, with treatments such as purgation and phlebotomy.","['bile', 'disease', 'medical', 'phlebotomy', 'purgation', 'treatment', 'yellow']"
MS-TS-AS-00180-00267,Medical,0500-01-01,1899-12-31,"Medical text on the management of a disease that affects the yellow bile, with treatments such as purgation and phlebotomy.","['bile', 'disease', 'medical', 'phlebotomy', 'purgation', 'treatment', 'yellow']"
MS-TS-AS-00181-00003,Medical,0500-01-01,1899-12-31,Leaf from a medical work that issues a warning against excessive use of medicine.,"['excessive', 'medical', 'medicine']"
MS-TS-AS-00181-00007,Medical,0500-01-01,1899-12-31,Medical text dealing with throat complaints.,['medical']
MS-TS-AS-00181-00012,Medical,0500-01-01,1899-12-31,Medical text referring to inflammation.,"['inflammation', 'medical']"
MS-TS-AS-00181-00013,Medical,0500-01-01,1899-12-31,"Leaf from an ophthalmological work, with instructions of how to prepare compound medicines, mentioning camphor.","['camphor', 'medicine', 'ophthalmological', 'prepare']"
MS-TS-AS-00181-00035,Medical,0500-01-01,1899-12-31,"Medical text dealing with acute disease accompanied by fever, recommeding rob of liquorice for coughs or for those who suffer from pleurisy or diarrhoea (recto), and julep with rose-water for headaches and giddiness. Marginal reference to inflammation of the liver and stomach.","['cough', 'diarrhoea', 'disease', 'fever', 'giddiness', 'headache', 'inflammation', 'liquorice', 'liver', 'medical', 'pleurisy', 'rose-water', 'stomach', 'suffer']"
MS-TS-AS-00181-00082,Medical,0500-01-01,1899-12-31,"Fragment from a medical work, here focusing on recipes for sexual medicine. One recipe to strengthen the penile erection contains dodder, celery seeds, opopanax, brassica eruca seeds, ginger, saffron, fresh milk, and butter.","['brassica', 'butter', 'celery', 'dodder', 'eruca', 'ginger', 'medical', 'medicine', 'milk', 'opopanax', 'penile', 'saffron', 'sexual', 'strengthen']"
MS-TS-AS-00181-00083,Medical,0500-01-01,1899-12-31,"Leaf from a work of materia medica, including a list of simples, their actions and uses as abortifacients, diuretics, emmenagogues, helminthicides, expectorants, soporifics and as local applications to heal ulceration of the skin.","['diuretic', 'emmenagogue', 'heal', 'helminthicides', 'medica', 'skin', 'soporific', 'ulceration']"
MS-TS-AS-00181-00084,Medical,0500-01-01,1899-12-31,"Part of a leaf from a medical work on ophthalmology, with questions and answers on eye diseases, ectropion, swelling and inflammation of the eye, pterygium and residual mucus in the corner of the eye.","['disease', 'ectropion', 'eye', 'inflammation', 'medical', 'mucus', 'ophthalmology', 'pterygium', 'swelling']"
MS-TS-AS-00181-00085,Medical,0500-01-01,1899-12-31,"Fragment from an ophthalmological work, mentioning corneal ulcers and perforation of the cornea.","['cornea', 'corneal', 'ophthalmological', 'perforation', 'ulcer']"
MS-TS-AS-00181-00087,Medical; magical,0500-01-01,1899-12-31,"Amulet with characteres and a drawing, protecting against eye inflammation.","['eye', 'inflammation']"
MS-TS-AS-00181-00095,Medical,0500-01-01,1899-12-31,Medical text dealing with the management of fevers.,"['fever', 'medical']"
MS-TS-AS-00181-00108,Medical,0500-01-01,1899-12-31,"Small fragment from a medical work, with a recipe to treat a liver complaint.","['liver', 'medical', 'treat']"
MS-TS-AS-00181-00112,Medical,0500-01-01,1899-12-31,"Fragment from a medical work, mentioning recipes.",['medical']
MS-TS-AS-00181-00118,Medical,0500-01-01,1899-12-31,"Leaf from a medical work dealing with diagnosis of the pulse and urinary abnormalities, and discussing blood, excessive heat, colour of urine, and condition of faculties.","['blood', 'colour', 'condition', 'diagnosis', 'excessive', 'heat', 'medical', 'pulse', 'urinary', 'urine']"
MS-TS-AS-00181-00124,Medical,0500-01-01,1899-12-31,Leaf from a medical work dealing with diseases of the liver.,"['disease', 'liver', 'medical']"
MS-TS-AS-00181-00169,Medical,0500-01-01,1899-12-31,Leaf from a medical work dealing with diseases of the liver.,"['disease', 'liver', 'medical']"
MS-TS-AS-00181-00186,Medical,0500-01-01,1899-12-31,"Leaf from a medical work dealing with ophthalmology, with questions and answers on eye diseases, trachoma, blepharitis, epiphora, and congestion of the blood vessels of the eye.","['blepharitis', 'blood', 'disease', 'epiphora', 'eye', 'medical', 'ophthalmology', 'trachoma', 'vessel']"
MS-TS-AS-00181-00193,Medical; list,0500-01-01,1899-12-31,List of materia medica.,['medica']
MS-TS-AS-00181-00194,Medical,0500-01-01,1899-12-31,"Medical text, written in large script, referring to conditions such as coughs, fever, vitiligo, leprosy, tinea of the scalp, dry and wet itch.","['condition', 'cough', 'fever', 'itch', 'leprosy', 'medical', 'scalp', 'tinea', 'vitiligo']"
MS-TS-AS-00181-00195,Medical; list,0500-01-01,1899-12-31,"List of materia medica, with Coptic numerals. Isaacs (1994) suggests that it presents a ‘diet for invalids’.","['diet', 'medica']"
MS-TS-AS-00181-00196,Medical,0500-01-01,1899-12-31,"Leaf from a medical work on ophthalmology, with questions and answers on eye diseases, eye redness and heat.","['disease', 'eye', 'heat', 'medical', 'ophthalmology', 'redness']"
MS-TS-AS-00181-00211,Medical,0500-01-01,1899-12-31,"Translation of Hippocrates, Aphorisms V: 1-7, into Arabic.","['aphorism', 'hippocrates']"
MS-TS-AS-00181-00232,Medical,0500-01-01,1899-12-31,"Medical text, with recipes that include simples such as socotrine aloes, yellow myrobalan, colocynth pith, and sagapenum.","['aloe', 'colocynth', 'medical', 'myrobalan', 'pith', 'sagapenum', 'yellow']"
MS-TS-AS-00181-00234,Medical; magical,0500-01-01,1899-12-31,"Amulet to protect against injury or disease, with magical characteres and other magical scripts (one resembles Kufi script and another is vaguely Greek).","['disease', 'injury', 'magical']"
MS-TS-AS-00181-00237,Medical,0500-01-01,1899-12-31,Medical text dealing with the treatment of headaches and head colds. Treatment comprises the application of wine vinegar.,"['cold', 'head', 'headache', 'medical', 'treatment', 'vinegar', 'wine']"
MS-TS-AS-00181-00271,Medical,0500-01-01,1899-12-31,"Leaf from a medical work, containing recipes to treat complaints in the points of the upper and lower extremities. Simples used include fat of the stag, origanum water, bitter vetch, borax, and pepper.","['borax', 'fat', 'medical', 'origanum', 'pepper', 'stag', 'treat', 'vetch', 'water']"
MS-TS-AS-00181-00282,Medical,0500-01-01,1899-12-31,Small fragment mentioning materia medica.,['medica']
MS-TS-AS-00182-00009,Medical,0500-01-01,1899-12-31,"Small fragment from a medical work, dealing with liver disease and mentioning the use of Daphne mezereum.","['daphne', 'disease', 'liver', 'medical', 'mezereum']"
MS-TS-AS-00182-00011,Medical; letter,0500-01-01,1899-12-31,Recto: letter from a certain Abū l-Qasam (?). Verso: title page of a book of recipes used in the ʿAḍūḍī hospital in Baghdad.,[]
MS-TS-AS-00182-00018,Medical,0500-01-01,1899-12-31,"Medial text dealing with strokes, convulsions, haemorrhages and tetany.","['convulsion', 'haemorrhage', 'tetany']"
MS-TS-AS-00182-00024,Medical,0500-01-01,1899-12-31,"Ophthalmological work, dealing with the inner cants of the eye. In margin, unidentified Hebrew or Judaeo-Arabic text.","['eye', 'ophthalmological']"
MS-TS-AS-00182-00037,Medical,0500-01-01,1899-12-31,"Recipes for pastes, with simples such as wine, celery, pepper, euphorbia, and jujube.","['celery', 'pepper', 'wine']"
MS-TS-AS-00182-00053,Medical,0500-01-01,1899-12-31,"Fragment with only a few words preserved from a medical work. Topics treated are written in the margin, here ‘Treatment of pain’.","['medical', 'pain', 'treated', 'treatment']"
MS-TS-AS-00182-00056,Medical,0500-01-01,1899-12-31,"Small fragment from a translation of Hippocrates, Aphorisms.","['aphorism', 'hippocrates']"
MS-TS-AS-00182-00065,Medical; jottings,0500-01-01,1899-12-31,"Recto: colophon of a medical book called Kitāb fī l-ṭibb, owned by Ibrahim al-Ma[..]ūdī, the Rabbanite, known as Ibn al-Ḥarīrī. Verso: jottings with Coptic numerals.","['colophon', 'medical']"
MS-TS-AS-00182-00077,Medical; jottings,0500-01-01,1899-12-31,"Recto: part of a text on dentistry and oral hygiene, discussing dental caries, dentifrice powder prepared from gigantic swallowwort and burnt snails. Perhaps Ibn al-Jazzār, Zād al-musāfir wa-qūt al-ḥāḍir (‘Provisions for the traveller and nourishment for the sedentary’). Verso: jottings in large letters, probably part of a document.","['burnt', 'dental', 'dentifrice', 'dentistry', 'gigantic', 'hygiene', 'nourishment', 'oral', 'powder', 'prepared', 'snail', 'swallowwort']"
MS-TS-AS-00182-00098,Medical,0500-01-01,1899-12-31,"Fragment from a medical work, discussing the management of a patient and treatment of disease through purgation and phlebotomy.","['disease', 'medical', 'patient', 'phlebotomy', 'purgation', 'treatment']"
MS-TS-AS-00182-00099,Medical,0500-01-01,1899-12-31,"Recto: recipe comprising mastic, anise, chicory, berberis, and liquorice. Verso: unidentified text.","['anise', 'chicory', 'liquorice', 'mastic']"
MS-TS-AS-00182-00167,Medical,0500-01-01,1899-12-31,"Recipe comprising convolvulus scammonia, salt, frankincense, and cinnamon.","['cinnamon', 'convolvulus', 'frankincense', 'salt', 'scammonia']"
MS-TS-AS-00182-00170,Medical,0500-01-01,1899-12-31,"Leaf from Avicenna, Al-qanūn fī l-ṭibb (‘Canon of medicine’), in an abridged version, or perhaps an expanded table of contents, for chapters 17 on enemas, 18 on topical applications to the skin, 19 on lotions and 20 on phlebotomy (ed. Būlāq I: 204).","['enema', 'lotion', 'medicine', 'phlebotomy', 'skin', 'topical']"
MS-TS-AS-00182-00179,Medical; list; document; letter (?),0500-01-01,1899-12-31,"List of quantities of materia medica, including simples such as senna, purslane seeds, apricot, almond oil, saffron oil, and Chinese cinnamon. Judging by the continuation sign on the top of the page, this is page is part of another a document, probably a letter.","['almond', 'apricot', 'cinnamon', 'medica', 'oil', 'purslane', 'saffron', 'senna']"
MS-TS-AS-00182-00183,Medical,0500-01-01,1899-12-31,"Fragment with a recipe that includes simples such as mastic, aloes, Mimosa nilotica, mace, purslane, and large basil.","['aloe', 'basil', 'mace', 'mastic', 'mimosa', 'nilotica', 'purslane']"
MS-TS-AS-00182-00195,Medical,0500-01-01,1899-12-31,"Fragment from ʿAlī Ibn ʿĪsā, Taḏkirat al-kaḥḥālīn (‘Memorandum for opticians’), third discourse, chapter 3, on the diseases of the lens and the anachroid (ed. Hyderabad 1964, pp. 289-291).","['disease', 'lens', 'optician']"
MS-TS-AS-00182-00196,Medical,0500-01-01,1899-12-31,"Fragment from ʿAlī Ibn ʿĪsā, Taḏkirat al-kaḥḥālīn (‘Memorandum for opticians’), third discourse, chapter 4, on the visual spirit (ed. Hyderabad 1964, p. 291).",['optician']
MS-TS-AS-00182-00197,Medical,0500-01-01,1899-12-31,Small fragment from a medical work that mentions feverish shivering.,"['feverish', 'medical', 'shivering']"
MS-TS-AS-00182-00222,Medical; list,0500-01-01,1899-12-31,"List of materia medica, including simples such as lavender, sebesten, peruse, ground gallnut, myrtle seeds, caraway, pepper, and poppy. With Coptic numerals.","['caraway', 'gallnut', 'lavender', 'medica', 'myrtle', 'pepper', 'poppy', 'sebesten']"
MS-TS-AS-00182-00233,Medical; list,0500-01-01,1899-12-31,"List of materia medica, including simples such as pepper, nard, and Prunus mahaleb. With Coptic numerals.","['mahaleb', 'medica', 'nard', 'pepper', 'prunus']"
MS-TS-AS-00182-00241,Medical,0500-01-01,1899-12-31,Small fragment from a medical work; deals with pain.,"['medical', 'pain']"
MS-TS-AS-00182-00242,Medical; list; letter; document,0500-01-01,1899-12-31,"Recto: document, with a continuation sign at the top of the page, indicating that it is part of a longer document, perhaps a letter. Verso: list of materia medica, such as doronicum, Chinese cinnamon, crystalline sugar, mace, borage-water, nard, cloves, Myristica fragrant, Elettaria cardamom and Cissus vitiginea. With Coptic numerals.","['borage-water', 'cardamom', 'cinnamon', 'cissus', 'clove', 'fragrant', 'mace', 'medica', 'myristica', 'nard', 'sugar', 'vitiginea']"
MS-TS-AS-00182-00258,Medical; list,0500-01-01,1899-12-31,"List of materia medica, with Coptic numerals.",['medica']
MS-TS-AS-00182-00262,Medical,0500-01-01,1899-12-31,Leaf from a collection of Hippocratic Aphorisms.,"['aphorism', 'hippocratic']"
MS-TS-AS-00182-00267,Medical; list; document,0500-01-01,1899-12-31,"Recto: list of medical substances for a prescription, with Coptic numerals. Verso: document, probably a note relating to trade.","['medical', 'prescription']"
MS-TS-AS-00182-00269,Medical,0500-01-01,1899-12-31,"Medical work, discussing inflammatory swellings, and their symptoms and signs, as well as fever and loss of weight. Rubrication of particular words and, more unusually, of the Arabic vocalisation.","['fever', 'inflammatory', 'medical', 'swelling', 'weight']"
MS-TS-AS-00182-00273,Medical,0500-01-01,1899-12-31,"Leaf from a medical work, which discusses evacuation, such as the method of elimination by vomiting in dry climate, and medicaments which cause congestion of the pores and sweating. Marginal jottings.","['cause', 'elimination', 'medical', 'medicament', 'pore', 'sweating', 'vomiting']"
MS-TS-AS-00182-00298,Medical; list,0500-01-01,1899-12-31,"Leaf from a medical work, which discusses preparations of ointments, including one to to treat scrofula and bubo, a lead ointment to treat ulcers, and a verdigris ointment to treat deeply penetrating and chronic ulcers.","['bubo', 'chronic', 'lead', 'medical', 'ointment', 'penetrating', 'preparation', 'treat', 'ulcer', 'verdigris']"
MS-TS-AS-00182-00303,Medical; list,0500-01-01,1899-12-31,"List of materia medica, including simples such as Convolvulus scammonia, mastic, amber, liquorice, and camphor.","['amber', 'camphor', 'convolvulus', 'liquorice', 'mastic', 'medica', 'scammonia']"
MS-TS-AS-00182-00308,Medical,0500-01-01,1899-12-31,"Medical work presenting dishes to prepare for invalids, with ingredients such as chicken, fish, milk, and honey, with sweet dishes prepared from flour and rosewater.","['chicken', 'flour', 'honey', 'medical', 'milk', 'prepare', 'prepared', 'rosewater']"
MS-TS-AS-00182-00320,Medical,0500-01-01,1899-12-31,"Medical work, dealing with complications of diseases of the liver, spleen, kidneys and bladder, with a discussion of ascites.","['ascites', 'bladder', 'disease', 'kidney', 'liver', 'medical', 'spleen']"
MS-TS-AS-00183-00035,Medical,0500-01-01,1899-12-31,"Small fragment from a medical text, discussing the innate heat of the body.","['body', 'heat', 'medical']"
MS-TS-AS-00183-00058,Medical; astrological; divination,0500-01-01,1899-12-31,"Astrological or related divinatory text, which on recto includes prognostications regarding the colour of people and their temperament. Planets and the shape of star signs are discussed on verso. On both sides, there are patterns of dots.","['astrological', 'colour', 'divinatory', 'side', 'star']"
MS-TS-AS-00183-00061,Medical,0500-01-01,1899-12-31,"Fragment from a medical text, which contains a recipe.",['medical']
MS-TS-AS-00183-00078,Medical,0500-01-01,1899-12-31,"Small fragment from a medical codex, which discusses the flow of humours, lachrymal abcess and fistulas on recto, and treatment of stye, loss of eyelashes, ulcers of the eyelids and atheroma of the eyelids.","['abcess', 'eyelash', 'eyelid', 'fistula', 'humour', 'lachrymal', 'medical', 'stye', 'treatment', 'ulcer']"
MS-TS-AS-00183-00104,Medical,0500-01-01,1899-12-31,"Probably a medical text, which repeatedly quotes al-Raʾīs, a nickname of Avicenna.",['medical']
MS-TS-AS-00183-00106,Medical,0500-01-01,1899-12-31,"Fragment from a medical book, which contains a recipe with simples such as dodder, flax, stoneless raisins, myrtle leaves, and Chinese cinnamon.","['cinnamon', 'dodder', 'flax', 'medical', 'myrtle', 'raisin']"
MS-TS-AS-00183-00112,Medical,0500-01-01,1899-12-31,"Medical text, which includes a chapter 4 on urine formation and its excretion, quoting a certain Isaac, probably Isaac Israeli. Examination of urine for its colour and consistency, and signs of imminent death.","['colour', 'death', 'excretion', 'medical', 'urine']"
MS-TS-AS-00183-00119,Medical,0500-01-01,1899-12-31,"Medical work discussing Hippocratic aphorisms on types of breathing, sweating around the neck and forehead, and management of patients.","['aphorism', 'breathing', 'forehead', 'hippocratic', 'medical', 'neck', 'patient', 'sweating']"
MS-TS-AS-00183-00123,Medical,0500-01-01,1899-12-31,"Medical work discussing Hippocratic aphorisms on types of breathing, sweating around the neck and forehead, and management of patients.","['aphorism', 'breathing', 'forehead', 'hippocratic', 'medical', 'neck', 'patient', 'sweating']"
MS-TS-AS-00183-00131,Medical; astrological,0500-01-01,1899-12-31,"Beginning of the first chapter of an astrological book dealing with prognostications concerning health and disease, fevers, painful fistulae and rainfall.","['astrological', 'disease', 'fever', 'fistula', 'health', 'painful']"
MS-TS-AS-00183-00135,Medical,0500-01-01,1899-12-31,"Fragment from a medical work, discussing the causes and signs of abscesses, for example abdominal abcesses, and their treatment.","['abcesses', 'abdominal', 'abscess', 'cause', 'medical', 'treatment']"
MS-TS-AS-00183-00144,Medical,0500-01-01,1899-12-31,"Pages from a medical work, discussing the treatment of chronic trachoma, ear diseases, and skin complaints, quoting Oribasius.","['chronic', 'disease', 'ear', 'medical', 'skin', 'trachoma', 'treatment']"
MS-TS-AS-00183-00148,Medical,0500-01-01,1899-12-31,"Leaf from a medical work, discussing sexual medicine, such as amenorrhoea, gynaecology, and pregnancy.","['amenorrhoea', 'gynaecology', 'medical', 'medicine', 'pregnancy', 'sexual']"
