classmark,title,date_from,date_to,summary,medical_terms
MS-TS-NS-00289-00127,Medical,0500-01-01,1899-12-31,Collection of Hippocratic aphorisms in no apparent order.,"['aphorism', 'hippocratic']"
MS-TS-NS-00298-00063,Medical; calendrical,0500-01-01,1899-12-31,"Recto: medical notes regarding different kinds of headache, throbbing in the ears and vertigo, their symptoms and cure. Verso: part of a Judaeo-Arabic work discussing the Hebrew calendar and how it is calculated.","['cure', 'ear', 'headache', 'medical', 'throbbing', 'vertigo']"
MS-TS-NS-00305-00003,Medical,0500-01-01,1899-12-31,"Portion of a medical work, discussing the humours (blood and phlegm), the internal bodily heat and providing a list of simple medicaments.","['blood', 'bodily', 'heat', 'humour', 'medical', 'medicament', 'phlegm', 'portion']"
MS-TS-NS-00305-00004,Medical,0500-01-01,1899-12-31,"End of Ibn al-Jazzār, Kitāb al-madḵal ilā taʿallum ṣināʿat al-ṭibb (‘Introduction to the study of medicine’), with an undated colophon.","['colophon', 'medicine']"
MS-TS-NS-00305-00005,Medical,0500-01-01,1899-12-31,"Part of Ibn Al-Jazzār, Kitāb al-madḵal ilā taʿallum ṣināʿat al-ṭibb (‘Introduction to the study of medicine’).",['medicine']
MS-TS-NS-00305-00013,Medical; astrological,0500-01-01,1899-12-31,"Composite fragment including astrological prognostications, magical formulae, and a discussion of blood in the body and the forces of nature.","['astrological', 'blood', 'body', 'magical']"
MS-TS-NS-00305-00018,Medical,0500-01-01,1899-12-31,"Description of a complex illness and its various symptoms: headache, abdominal pain, skin rush, suppuration, and lethargy.","['abdominal', 'headache', 'illness', 'lethargy', 'pain', 'skin', 'suppuration']"
MS-TS-NS-00305-00021,Medical,0500-01-01,1899-12-31,"Portion of work on pharmacology and ophthalmology, with a description of useful medicaments obtained from plants and minerals, and how to manage the diseased patient during the various phases of the illness.","['diseased', 'illness', 'medicament', 'mineral', 'ophthalmology', 'patient', 'pharmacology', 'plant', 'portion']"
MS-TS-NS-00305-00024,Medical,0500-01-01,1899-12-31,"Part of a medical work dealing with fever, and with the weakening and wasting of the body during a protracted period of fever.","['body', 'fever', 'medical', 'wasting', 'weakening']"
MS-TS-NS-00305-00026,Medical,0500-01-01,1899-12-31,"Page from a medical or bibliographical work deriving from Ibn Abī Uṣaybiʿa, ʾUyūn al-anbā fī ṭabaqāt al-aṭibbāʾ (‘Lives of the physicians’), comprising the listing of works by Galen (ed. Beirut 1965, pp.139-140).","['galen', 'life', 'medical', 'physician']"
MS-TS-NS-00305-00034,Medical,0500-01-01,1899-12-31,"Part of a page from a medical work here dealing with hunger and appetite, and addressing the problem of eating disorders, in particular bulimia.","['appetite', 'bulimia', 'disorder', 'hunger', 'medical']"
MS-TS-NS-00305-00038,Medical,0500-01-01,1899-12-31,"List of materia medica, possibly a shopping list for medicinal substances, with quantities expressed in Coptic numerals. Simples listed include sugar, pepper, and salt.","['medica', 'medicinal', 'pepper', 'salt', 'sugar']"
MS-TS-NS-00305-00040,Medical,0500-01-01,1899-12-31,"Part of a page from Ḥunayn ibn Isḥāq, al-masāʾil fī l-ṭibb (‘Questions on medicine’), presented in the form of questions and answers. The fragment deals with the colour of urine (ed. Cairo 1938, pp. 301-304).","['colour', 'medicine', 'urine']"
MS-TS-NS-00305-00045,Medical; letter,0500-01-01,1899-12-31,Part of letter (possibly a draft) mentioning medical material. Possibly a request for medical supplies by a druggist of pharmacist,"['druggist', 'medical', 'pharmacist']"
MS-TS-NS-00305-00050,Medical,0500-01-01,1899-12-31,"Recipe for treating stomach and intestinal problems (colics and flatulence) with opium, sugar, and opopanax .","['colic', 'flatulence', 'intestinal', 'opopanax', 'stomach', 'sugar', 'treating']"
MS-TS-NS-00305-00058,Medical,0500-01-01,1899-12-31,"Collection of medical recipes, opening with a basmala and aimed at aiding digestion and curing flatulence.","['basmala', 'curing', 'flatulence', 'medical']"
MS-TS-NS-00305-00065,Medical,0500-01-01,1899-12-31,Part of a medical work dealing with the pulse. Recto: the pulse in patients suffering from amnesia. Verso: beginning of ‘Chapter 4: the pulse in patients affected by consumption and wasting’.,"['amnesia', 'medical', 'patient', 'pulse', 'suffering', 'wasting']"
MS-TS-NS-00305-00069,Medical,0500-01-01,1899-12-31,"List of simple medicaments, including opium, dragon’s blood, tragacanth, tutty, pepper, and pearl.","['blood', 'dragon', 'medicament', 'pearl', 'pepper', 'tragacanth']"
MS-TS-NS-00305-00075,Medical,0500-01-01,1899-12-31,"Medical recipe prescribing a composition of anise, borage, celery root, polypody, and fennel.","['anise', 'celery', 'fennel', 'medical', 'polypody', 'prescribing', 'root']"
MS-TS-NS-00305-00082,Letter; Medical,1140-01-01,1140-12-31,"Recto: part of a letter mentioning ‘the pharmacists’. Letter is from Fusṭāṭ and dated 1751 of the Seleucid era (=1140 CE). Verso: part of an Arabic letter, mentioning Abū Saʿīd and Abū Naṣr.",['pharmacist']
MS-TS-NS-00305-00084,Medical,0500-01-01,1899-12-31,Part of a work on materia medica with a description of the qualities of simples; description of wound dressing for curing inflammation of the testicles and women’s breasts. It quotes Dioscorides.,"['breast', 'curing', 'inflammation', 'medica', 'testicle', 'wound']"
MS-TS-NS-00305-00095,Medical,0500-01-01,1899-12-31,"Part of a page from an Arabic medical work, dealing with the anatomy of fingers, phalanges, nails, wrists, and arms. Plotinus is quoted.","['anatomy', 'finger', 'medical', 'phalanx']"
MS-TS-NS-00305-00101,Medical,0500-01-01,1899-12-31,"Arabic translation of Hippocrates, Aphorisms I: 3, 5, 7, 10.","['aphorism', 'hippocrates']"
MS-TS-NS-00305-00107,Medical,0500-01-01,1899-12-31,"From a book on pharmacopoeia describing the preparation of topical applications for curing skin diseases, for paralysis, for backache and pain in the knee joints; description of a lotion for brightening facial skin.","['backache', 'curing', 'disease', 'facial', 'knee', 'lotion', 'pain', 'paralysis', 'pharmacopoeia', 'preparation', 'skin', 'topical']"
MS-TS-NS-00305-00112,Medical,0500-01-01,1899-12-31,"Page from a work on pharmacopoeia with description of medicaments and ailments, including the protrusion of the eyeballs.","['ailment', 'eyeball', 'medicament', 'pharmacopoeia']"
MS-TS-NS-00305-00117,Medical,0500-01-01,1899-12-31,"Dāniāl ibn Shuʿyā’s commentary in Arabic on ʾAlī ibn Īsā, Taḏkirat al-Kaḥḥālīn (‘Memorandum for opticians’), including title page and opening.",['optician']
MS-TS-NS-00305-00136,Medical,0500-01-01,1899-12-31,Part of a medical recipe.,['medical']
MS-TS-NS-00305-00166,Medical,0500-01-01,1899-12-31,"Heading and beginning of chapter 6 from an unidentified medical work, mentioning phlegm and swellings.","['medical', 'phlegm', 'swelling']"
MS-TS-NS-00305-00199,Medical,0500-01-01,1899-12-31,"Small fragment from a theoretical medical work, discussing the humours and their mixture in the human body.","['body', 'human', 'humour', 'medical']"
MS-TS-NS-00305-00212,Medical,0500-01-01,1899-12-31,"Medico-cosmetic text with recipes for a dark hair-dye made of henna, fig leaves, beet leaves, barely water, and natron.","['barely', 'beet', 'hair-dye', 'medico-cosmetic', 'natron', 'water']"
MS-TS-NS-00305-00214,Medical,0500-01-01,1899-12-31,"Part of a medical work dealing with problematic digestion, its causes and cure.","['cause', 'cure', 'medical']"
MS-TS-NS-00306-00004,Medical,0500-01-01,1899-12-31,"Part of a medical work dealing with diseases affecting the internal organs: hardening of the spleen, abdominal and hepatic ailments, looseness of the bowels. Treatments suggested include a preparation of oxymel and berberis.","['abdominal', 'ailment', 'bowel', 'disease', 'hardening', 'medical', 'organ', 'oxymel', 'preparation', 'spleen', 'treatment']"
MS-TS-NS-00306-00007,Medical,0500-01-01,1899-12-31,"Part of a medical work, here dealing with general principles for dealing with diseases.","['disease', 'medical']"
MS-TS-NS-00306-00009,Medical,0500-01-01,1899-12-31,Small piece from a medical work mentioning the bodily organs.,"['bodily', 'medical', 'organ']"
MS-TS-NS-00306-00012,Medical,0500-01-01,1899-12-31,"Page from Ḥunayn ibn Isḥāq, Al-masāʾil fī l-ṭibb (‘Questions on medicine’), dealing with the cooling and heating properties of medicines and simple remedies (ed. Cairo 1978, pp. 134-139).","['cooling', 'heating', 'medicine', 'remedy']"
MS-TS-NS-00306-00024,Medical,0500-01-01,1899-12-31,Page from a medical work dealing with the topic of natural philosophy (causation) and medicine (symptoms and signs of inflammation).,"['causation', 'inflammation', 'medical', 'medicine']"
MS-TS-NS-00306-00025,Medical,0500-01-01,1899-12-31,"Page from a medical work dealing with the treatment of bodily and facial palsy, tetanus, colics, flatulence and gout.","['bodily', 'colic', 'facial', 'flatulence', 'gout', 'medical', 'palsy', 'tetanus', 'treatment']"
MS-TS-NS-00306-00029,Medical,0500-01-01,1899-12-31,"From a pharmacological work, including parts of medical recipes. Ingredients mentioned are terebinth, oil of balsam, and galbanum.","['balsam', 'medical', 'oil', 'pharmacological', 'terebinth']"
MS-TS-NS-00306-00030-A,Medical,0500-01-01,1899-12-31,Part of a medical recipe and a theoretical discussion on the efficacy of medicaments.,"['efficacy', 'medical', 'medicament']"
MS-TS-NS-00306-00030-B,Medical,0500-01-01,1899-12-31,Part of a medical recipe for curing alopecia.,"['alopecia', 'curing', 'medical']"
MS-TS-NS-00306-00032,Medical,0500-01-01,1899-12-31,"Part of recipe - possibly of an alchemical nature - including the ingredients sublimated arsenic, sublimated lead, and salt.","['alchemical', 'arsenic', 'lead', 'salt', 'sublimated']"
MS-TS-NS-00306-00033,Medical,0500-01-01,1899-12-31,Medical recipe for the preparation of a compound drug based on camphor.,"['camphor', 'drug', 'medical', 'preparation']"
MS-TS-NS-00306-00035,Medical,0500-01-01,1899-12-31,Small piece of a medical recipe.,['medical']
MS-TS-NS-00306-00042,Medical; jottings,0500-01-01,1899-12-31,"Medical notebook dealing with the treatment of wet suppurating ulcers, with mention of ʿAlī ibn Riḍwān’s commentary on Galen, followed by a medical recipe in Judaeo-Arabic.","['galen', 'medical', 'suppurating', 'treatment', 'ulcer']"
MS-TS-NS-00306-00045,Medical,0500-01-01,1899-12-31,"Fragment of pharmacopoeia, describing the preparation of an arsenic compound.","['arsenic', 'pharmacopoeia', 'preparation']"
MS-TS-NS-00306-00046,Medical,0500-01-01,1899-12-31,"Passages from the introduction of ʿAlī ibn ʿĪsā, Taḏkirat al-kaḥḥālīn (‘Memorandum for opticians’), possibly a draft (ed. Hyderabad 1964, p. 3). Verso mentions ‘the Epistles of the brethren of purity’.","['optician', 'purity']"
MS-TS-NS-00306-00048,Medical; Letter,0500-01-01,1899-12-31,"Part of a medical notebook dealing with ophthalmology. Recto contains a list of simples used for curing eye complaints and follows roughly the list found in ʿAlī ibn ʿĪsā, Taḏkirat al-kaḥḥālīn (ed. Hyderabad 1964, p. 347). Simples mentioned include antimony, sarcocolla, ceruse, acacia, lichen, gum of sal ammoniac, myrtle, melitot, galbanum, onions, borax, lettuce seeds, zinc oxide, and egg white. Verso: letter referring to a certain Sulaymān Ibn Mūsā, the physician, who is practising medicine at the hospital in Cairo.","['acacia', 'ammoniac', 'antimony', 'borax', 'ceruse', 'curing', 'egg', 'eye', 'gum', 'lettuce', 'lichen', 'medical', 'medicine', 'melitot', 'myrtle', 'onion', 'ophthalmology', 'oxide', 'physician', 'sal', 'sarcocolla', 'zinc']"
MS-TS-NS-00306-00054,Medical,0500-01-01,1899-12-31,"Portion of book on pharmacopoeia, with recipes for two potions, one derived from Galen and one from Archigenes. Simples included are white pepper, polypody, gentian, dodder, carrot, sapagenum, castor, saffron, petroselinum, and cinnamon.","['carrot', 'castor', 'cinnamon', 'dodder', 'galen', 'pepper', 'petroselinum', 'pharmacopoeia', 'polypody', 'portion', 'potion', 'saffron']"
MS-TS-NS-00306-00056,Medical; astrological,0500-01-01,1899-12-31,Page from a medico-astrological book dealing with the influence of the planets on the health and life of those born under them.,"['born', 'health', 'life', 'medico-astrological']"
MS-TS-NS-00306-00073,Medical,0500-01-01,1899-12-31,"Recto: recipes for dealing with the loss of teeth. The ingredients mentioned include lentils, frankincense, and flower of pomegranate, Yemenite alum, chalk, saffron, nard, opium, scoria, gum and, elecampane. Verso: jottings and drafts of recipes.","['alum', 'chalk', 'elecampane', 'flower', 'frankincense', 'gum', 'lentil', 'nard', 'pomegranate', 'saffron', 'scoria', 'teeth']"
MS-TS-NS-00306-00074,Medical,0500-01-01,1899-12-31,"Fragment of medical book, dealing with quartan fevers, which are seen as the burning of black bile and phlegm in the body. Simples for producing remedies against fever are: rue leaves, honey, ginger, mastic, chalk, sandalwood, costus, oxymel, and rose.","['bile', 'body', 'burning', 'chalk', 'fever', 'ginger', 'honey', 'mastic', 'medical', 'oxymel', 'phlegm', 'remedy', 'rose', 'sandalwood']"
MS-TS-NS-00306-00079,Medical; astrological,0500-01-01,1899-12-31,"Part of an astrological work referring to Iraq and Egypt and offering prognostications of plagues, numerous diseases and new wars in the area.","['astrological', 'disease', 'plague']"
MS-TS-NS-00306-00081,Medical,0500-01-01,1899-12-31,"Arabic translation of Galen, De febrium differentiis (Kitāb ʾaṣnāf al-ḥummayāt), copied by the scribe Abū ʿUṯmān Saʿīd, including the end of the second discourse. Verso deals with pulse and sweat.","['galen', 'pulse', 'sweat']"
MS-TS-NS-00306-00082,Medical,0500-01-01,1899-12-31,"Arabic translation of Galen, De febrium differentiis (Kitāb ʾaṣnāf al-ḥummayāt), copied by the scribe Abū ʿUṯmān Saʿīd and dealing with pulse during fevers and different kinds of pulse.","['fever', 'galen', 'pulse']"
MS-TS-NS-00306-00083,Medical,0500-01-01,1899-12-31,"Passage from ʿAlī ibn ʿĪsā, Taḏkirat al-kaḥḥālīn (‘Memorandum for opticians’), including the end of chapter 5 and the beginning of chapter 6, on the anatomy of the different layers of the eye (ed. Hyderabad 1964, pp. 13-14).","['anatomy', 'eye', 'optician']"
MS-TS-NS-00306-00093,Medical,0500-01-01,1899-12-31,"From a medical work dealing mostly with dermatological ailments, and describing treatments for skin diseases and alopecia. Fragment also includes instructions for phlebotomy and medical baths.","['ailment', 'alopecia', 'bath', 'dermatological', 'disease', 'medical', 'phlebotomy', 'skin', 'treatment']"
MS-TS-NS-00306-00094,Medical,0500-01-01,1899-12-31,"Page from a lexicon of materia medica with a list of simples arranged alphabetically, preserving simples with the letters bāʾ and jīm and describing their actions and uses in treating ailments, in particular ailments of the skin, swellings and rashes.","['ailment', 'medica', 'rash', 'skin', 'swelling', 'treating']"
MS-TS-NS-00306-00095,Medical,0500-01-01,1899-12-31,"Page from Ḥunayn ibn Isḥāq, Al-masāʾil fī l-ṭibb (‘Questions on medicine’), dealing with the different types of diseases (ed. Cairo 1978, pp. 28-31).","['disease', 'medicine']"
MS-TS-NS-00306-00096,Medical,0500-01-01,1899-12-31,"Leaf from a book of theoretical medicine, dealing with motion and its effects on the heart, the production of innate heath and breathing.","['breathing', 'heart', 'heath', 'medicine']"
MS-TS-NS-00306-00097,Medical,0500-01-01,1899-12-31,"Leaf from a medical work dealing with ophthalmological issues, including weak vision and patients whose vision improves at night.","['medical', 'ophthalmological', 'patient', 'vision', 'weak']"
MS-TS-NS-00306-00098,Medical,0500-01-01,1899-12-31,"Bifolium preserving a portion of an Arabic commentary on Hippocrates, Aphorisms, dealing with pain, inflammation, ulceration, cold, epistaxis, bone fractures, spasms, and shivering.","['aphorism', 'bone', 'cold', 'epistaxis', 'fracture', 'hippocrates', 'inflammation', 'pain', 'portion', 'shivering', 'spasm', 'ulceration']"
MS-TS-NS-00306-00099,Medical,0500-01-01,1899-12-31,"Bifolium from a book of theoretical medicine, dealing with the different complexions that can characterise the human compound and their features.","['human', 'medicine']"
MS-TS-NS-00306-00100,Medical,0500-01-01,1899-12-31,"Piece from a book of theoretical medicine, dealing with the interconnectedness of the organs of the body during illness.","['body', 'illness', 'medicine', 'organ']"
MS-TS-NS-00306-00101,Medical,0500-01-01,1899-12-31,"Page from ʿAlī ibn ʿĪsā, Taḏkirat al-kaḥḥālīn (‘Memorandum for opticians’), including the end of chapter 1 and the beginning of chapter 2 (ed. Hyderabad 1964, pp. 69-70).",['optician']
MS-TS-NS-00306-00103,Medical; jottings,0500-01-01,1899-12-31,"Recto: jottings in Arabic and Judaeo-Arabic, including an Arabic table of contents. Verso: text from ʿAlī ibn ʿĪsā, Taḏkirat al-kaḥḥālīn (‘Memorandum for opticians’), from the second discourse, chapter 1 (ed. Hyderabad 1964, pp. 46-47).",['optician']
MS-TS-NS-00306-00115,Medical,0500-01-01,1899-12-31,"List of simples, possibly from a druggist’s notebook, including quantities expressed in Coptic numerals. Simples mentioned includes sesame oil, poppy seeds, pepper, mastic, sumac, saffron, carthamus, purslane seeds, and cinnamon.","['carthamus', 'cinnamon', 'druggist', 'mastic', 'oil', 'pepper', 'poppy', 'purslane', 'saffron', 'sesame', 'sumac']"
MS-TS-NS-00306-00129,Medical,0500-01-01,1899-12-31,Fragment from a medical work discussing the status of the healthy person and the use of drugs for preserving it.,"['drug', 'healthy', 'medical']"
MS-TS-NS-00306-00142,Medical,0500-01-01,1899-12-31,"Recto: note from al-šaykh Abū Saʿīd dealing with a monthly wage that partially consisted of an ounce of myrobalan, possibly for medicinal purposes. Verso: unidentified Arabic text, very fragmentary.","['medicinal', 'myrobalan']"
MS-TS-NS-00306-00168,Medical,0500-01-01,1899-12-31,Leaves from a work on opthalmology. P1 and P2 deal with illnesses affecting the eyelids; P3 describes recipes for medicaments for eye complaints; P4 describes the preparation of eye drops and contains additions in Judaeo-Arabic on the same topic; P5: notes in Arabic and Hebrew on eye care; P6 lists the simples used in recipes for eye medicaments.,"['care', 'eye', 'eyelid', 'illness', 'medicament', 'opthalmology', 'preparation']"
MS-TS-NS-00306-00172,Medical,0500-01-01,1899-12-31,"Leaves from a medical work, focussing on illnesses of the legs and nails, sciatica, varicose veins and the application of phlebotomy for these ailments. Simples deemed useful in these cases are dodder, marsh mallow, violet, wax, honey, celery-water, quince, natron, sagapenum, bdellium, and melitot.","['ailment', 'bdellium', 'celery-water', 'dodder', 'honey', 'illness', 'leg', 'mallow', 'medical', 'melitot', 'natron', 'phlebotomy', 'quince', 'sagapenum', 'sciatica', 'varicose', 'vein', 'violet', 'wax']"
MS-TS-NS-00306-00177,Medical,0500-01-01,1899-12-31,"Medical recipe prescribing a compound of chicory seeds, jujube, tamarind, and prune.","['chicory', 'medical', 'prescribing', 'prune', 'tamarind']"
MS-TS-NS-00306-00196,Medical; commentary; exercises,0500-01-01,1899-12-31,"Recto: draft of an Arabic translation of Hippocrates, Aphorisms I: 2 and Hebrew alphabetical exercises. Verso: unidentified portion of biblical discussion or commentary; further Hebrew alphabetical exercises.","['aphorism', 'exercise', 'hippocrates', 'portion']"
MS-TS-NS-00306-00211,Medical,0500-01-01,1899-12-31,"Fragment of a medical work dealing with regimen sanitatis, foods and medicines to be taken. It mentions Galen.","['food', 'galen', 'medical', 'medicine', 'regimen', 'sanitatis']"
MS-TS-NS-00306-00215,Medical,0500-01-01,1899-12-31,"From a medical work dealing with length of illnesses, fevers and foods for fostering recovery.","['fever', 'food', 'illness', 'medical']"
MS-TS-NS-00306-00220,Medical,0500-01-01,1899-12-31,"From a medical work dealing with general features of diseases and focussing on fevers, their different kinds and how to treat them.","['disease', 'fever', 'medical', 'treat']"
MS-TS-NS-00306-00221,Medical,0500-01-01,1899-12-31,"Part of an Arabic translation of Hippocrates, Prognosis (Arabic title: Kitāb taqdimat al-maʿrifa), describing the correct way of advising patients, with instructions to reassure them while explaining the nature of their ailments. Verso contains a portion of the title of the work and the name al-šaykh Ibrāhīm Ibn al-Ḏahabī","['ailment', 'hippocrates', 'patient', 'portion', 'prognosis']"
MS-TS-NS-00306-00222,Medical,0500-01-01,1899-12-31,"From a medical work dealing with fevers, with the flux of blood in blood vessels, with inflammation, and the bodily spirits. The fragments mentions Galen.","['blood', 'bodily', 'fever', 'flux', 'galen', 'inflammation', 'medical', 'vessel']"
MS-TS-NS-00306-00223,Medical,0500-01-01,1899-12-31,Part of a medical work dealing with baths and their beneficial effects on the function of the heart.,"['bath', 'heart', 'medical']"
MS-TS-NS-00306-00238,Medical,0500-01-01,1899-12-31,"Fragment of an Arabic medical book on vellum, dealing with medical ethics and the general treatment of patients.","['medical', 'patient', 'treatment']"
MS-TS-NS-00306-00239,Medical,0500-01-01,1899-12-31,"From an anatomical treatise dealing with the muscles of the mouth, the upper lip, the nose, and the chin.","['anatomical', 'chin', 'mouth', 'muscle', 'nose']"
MS-TS-NS-00306-00254,Medical,0500-01-01,1899-12-31,"Bifolium preserving an Arabic translation of Galen, On jaundice (Arabic title: Maqāla fī l-yaraqān), dealing with the definition of jaundice, its causes, symptoms and treatment, and with liver problems, including swollen liver, and the stagnation of bile in the blood vessels.","['bile', 'blood', 'cause', 'galen', 'jaundice', 'liver', 'stagnation', 'swollen', 'treatment', 'vessel']"
MS-TS-NS-00306-00255,Medical,0500-01-01,1899-12-31,"Bifolium preserving an Arabic translation of Galen, On jaundice (Arabic title: Maqāla fī l-yaraqān), dealing with conditions that affect the liver, spleen and urinary system at the same time. It mentions Rufus of Ephesus.","['condition', 'galen', 'jaundice', 'liver', 'spleen', 'urinary']"
MS-TS-NS-00306-00256,Medical,0500-01-01,1899-12-31,"From a work on natural philosophy, dealing with differences between the body and the soul, and the fact that the soul is simple, unique and has no form.",['body']
MS-TS-NS-00321-00034,Letter; medical,0500-01-01,1899-12-31,"Letter describing two meetings with physicians. The first was a visit to Maimonides, who discussed medical topics with the writer, the second was with another physician who visited the writer, checked his pulse and examined a flask of his urine. Mention is made of a trip to Alexandria. The fragment mentions others and their wealth: Abū Manṣūr, Abū l-Muḥāsin, Rīḍā al-Dawla, Ibn Ḥillel.","['medical', 'physician', 'pulse', 'urine']"
MS-TS-NS-00327-00014,Medical; exercises,0500-01-01,1899-12-31,"Opening page of ʿAlī ibn ʿĪsā, Taḏkirat al-Kaḥḥālīn (‘Memorandum for opticians’), with a mention of Galen in the introductory paragraph (ed. Hyderabad 1964, p.1). Recto upper margin contains Hebrew alphabetical exercises; lower margin contains three lines of text in Judaeo-Arabic that appear to be part of a letter dealing with trade or commerce.","['exercise', 'galen', 'optician']"
MS-TS-NS-00327-00016,Medical,0500-01-01,1899-12-31,"Leaf from a medical work dealing with fevers, malar flush, leprosy, and anasarca. Galen and ʿAlī (probably Al-Majūsī) are mentioned.","['anasarca', 'fever', 'flush', 'galen', 'leprosy', 'medical']"
MS-TS-NS-00327-00021,Medical,0500-01-01,1899-12-31,"Bifolium from ʿAlī ibn ʿĪsā, Taḏkirat al-Kaḥḥālīn (‘Memorandum for opticians’), second discourse, chapters 11-12, dealing with diseases of the eyelids, eyelashes, the falling out of eyelashes, and treatment of these conditions.","['condition', 'disease', 'eyelash', 'eyelid', 'optician', 'treatment']"
MS-TS-NS-00327-00022,Medical,0500-01-01,1899-12-31,"Leaf from an Arabic commentary on Avicenna, Al-qanūn fī l-ṭibb (‘Canon of medicine’), preserving the first faṣl of the first jumla, on pulse (ed. Bulāq 1871, I:123). Verso preserves a portion of the ninth faṣl, devoted to useful signs of illness for prognosis.","['illness', 'medicine', 'portion', 'prognosis', 'pulse']"
MS-TS-NS-00327-00038,Medical; astrology,0500-01-01,1899-12-31,Fragment from an astrological booklet associating the positions of the stars with the occurrence of illness and periods of health and happiness.,"['astrological', 'happiness', 'health', 'illness', 'star']"
MS-TS-NS-00327-00055,Medical,0500-01-01,1899-12-31,"Portion of the first faṣl of Avicenna, Al-qanūn fī l-ṭibb (‘Canon of medicine’), dealing with materia medica and listing simples under the letter alif (ed. Bulāq 1871, I: 248-249).","['medica', 'medicine', 'portion']"
MS-TS-NS-00327-00058,Medical,0500-01-01,1899-12-31,"Very damaged leaf from a medical work dealing with vomiting and epistaxis, and quoting Galen and Hippocrates.","['epistaxis', 'galen', 'hippocrates', 'medical', 'vomiting']"
MS-TS-NS-00327-00070,Medical,0500-01-01,1899-12-31,"Fragment of the opening chapter of Maimonides, Kitāb al-sumūm (‘Book on poisons’; ed. Bos, Leiden 2009, p. 4).",['poison']
